description,url
The North Face Sequoia short sleeve tech shirt in dark grey,https://www.asos.com/the-north-face/the-north-face-sequoia-short-sleeve-tech-shirt-in-dark-grey/prd/204490700?clr=grey&colourWayId=204490716&cid=3602
Farah Fraser check long sleeve shirt in blue,https://www.asos.com/farah/farah-fraser-check-long-sleeve-shirt-in-blue/prd/204548160?clr=blue&colourWayId=204548168&cid=3602
Marshall Artist koji overshirt in beige,https://www.asos.com/marshall-artist/marshall-artist-koji-overshirt-in-beige/prd/204559291?clr=beige&colourWayId=204559307&cid=3602
Marshall Artist Compata overshirt in off white,https://www.asos.com/marshall-artist/marshall-artist-compata-overshirt-in-off-white/prd/204559371?clr=white&colourWayId=204559376&cid=3602
GANT short sleeve cotton linen stripe relaxed fit shirt in mid blue,https://www.asos.com/gant/gant-short-sleeve-cotton-linen-stripe-relaxed-fit-shirt-in-mid-blue/prd/204659566?clr=mid-blue&colourWayId=204659572&cid=3602
Lee relaxed fit check twill shirt in light blue,https://www.asos.com/lee/lee-relaxed-fit-check-twill-shirt-in-light-blue/prd/204768987?clr=blue-sky&colourWayId=204768995&cid=3602
Lee workwear loose fit denim overshirt in mid wash CO-ORD,https://www.asos.com/lee/lee-mid-wash-denim-co-ord/grp/204951281?clr=anthem-blue&colourWayId=204769279&cid=3602#204769255
Topman Limited real suede shacket in black,https://www.asos.com/topman/topman-limited-real-suede-shacket-in-black/prd/204605024?clr=black&colourWayId=204605025&cid=3602
Nike Basketball Dri-Fit printed shirt in grey,https://www.asos.com/nike-basketball/nike-basketball-dri-fit-printed-shirt-in-grey/prd/203650660?clr=grey&colourWayId=203650682&cid=3602
Topman wool blend shacket in blue and brown check,https://www.asos.com/topman/topman-wool-blend-shacket-in-blue-and-brown-check/prd/200300420?clr=brown&colourWayId=200300429&cid=3602
ASOS DESIGN 90s oversized cord shirt in rust,https://www.asos.com/asos-design/asos-design-90s-oversized-cord-shirt-in-rust/prd/200914961?clr=rust&colourWayId=200914963&cid=3602
COLLUSION oversized brushed check shirt in yellow and blue,https://www.asos.com/collusion/collusion-oversized-brushed-check-shirt-in-yellow-and-blue/prd/201887936?clr=multi&colourWayId=201887941&cid=3602
ASOS DESIGN regular sheer shirt with ruffle front detail in red,https://www.asos.com/asos-design/asos-design-regular-sheer-shirt-with-ruffle-front-detail-in-red/prd/202295702?clr=red&colourWayId=202295713&cid=3602
ASOS DESIGN satin shirt with ruffle front in white,https://www.asos.com/asos-design/asos-design-satin-shirt-with-ruffle-front-in-white/prd/202295712?clr=white&colourWayId=202295723&cid=3602
ASOS DESIGN relaxed satin resort shirt with pleat detail in pale pink,https://www.asos.com/asos-design/asos-design-relaxed-satin-resort-shirt-with-pleat-detail-in-pale-pink/prd/202320958?clr=light-pink&colourWayId=202320968&cid=3602
ASOS DESIGN wool look shacket in sage green,https://www.asos.com/asos-design/asos-design-wool-look-shacket-in-sage-green/prd/202340420?clr=light-green&colourWayId=202340422&cid=3602
COLLUSION boxy short sleeve shirt in check,https://www.asos.com/collusion/collusion-boxy-short-sleeve-shirt-in-check/prd/202406986?clr=multi&colourWayId=202406995&cid=3602
Topman revere shirt with watermelon print in white and green,https://www.asos.com/topman/topman-revere-shirt-with-watermelon-print-in-white-and-green/prd/202426005?clr=white-and-green&colourWayId=202426021&cid=3602
Twisted Tailor butchart shirt in white with linear geo flocking,https://www.asos.com/twisted-tailor/twisted-tailor-butchart-shirt-in-white-with-linear-geo-flocking/prd/202532224?clr=white&colourWayId=202532225&cid=3602
ASOS DESIGN boxy oversized washed poplin shirt in grape,https://www.asos.com/asos-design/asos-design-boxy-oversized-washed-poplin-shirt-in-grape/prd/202576180?clr=grape&colourWayId=202576185&cid=3602
ASOS DESIGN super skinny mesh shirt in bright blue,https://www.asos.com/asos-design/asos-design-super-skinny-mesh-shirt-in-bright-blue/prd/202576245?clr=blue&colourWayId=202576278&cid=3602
ASOS DESIGN boxy oversized revere shirt in money print,https://www.asos.com/asos-design/asos-design-boxy-oversized-revere-shirt-in-money-print/prd/202652033?clr=green&colourWayId=202652034&cid=3602
ASOS DESIGN 90s oversized brushed flannel buffalo check shirt in blue,https://www.asos.com/asos-design/asos-design-90s-oversized-brushed-flannel-buffalo-check-shirt-in-blue/prd/202667801?clr=blue&colourWayId=202667807&cid=3602
ASOS DESIGN overshirt in navy wool mix check with borg collar,https://www.asos.com/asos-design/asos-design-overshirt-in-navy-wool-mix-check-with-borg-collar/prd/202667890?clr=navy&colourWayId=202667906&cid=3602
Vans saxon check shirt with multi pockets in oatmeal,https://www.asos.com/vans/vans-saxon-check-shirt-with-multi-pockets-in-oatmeal/prd/203225980?clr=neutral&colourWayId=203225986&cid=3602
Devils Advocate long sleeve geo print shirt in navy,https://www.asos.com/devils-advocate/devils-advocate-long-sleeve-geo-print-shirt-in-navy/prd/203261088?clr=navy&colourWayId=203261089&cid=3602
Devils Advocate long sleeve revere collar shirt in geo print in green,https://www.asos.com/devils-advocate/devils-advocate-long-sleeve-revere-collar-shirt-in-geo-print-in-green/prd/203261315?clr=mid-green&colourWayId=203261316&cid=3602
Lacoste printed long sleeve shirt in beige,https://www.asos.com/lacoste/lacoste-printed-long-sleeve-shirt-in-beige/prd/203306034?clr=beige&colourWayId=203306049&cid=3602
ASOS DESIGN boxy oversized suede shirt with revere collar in burgundy,https://www.asos.com/asos-design/asos-design-boxy-oversized-suede-shirt-with-revere-collar-in-burgundy/prd/203309809?clr=burgundy&colourWayId=203309811&cid=3602
Carhartt WIP cord rugby shirt in multi,https://www.asos.com/carhartt-wip/carhartt-wip-cord-rugby-shirt-in-multi/prd/203398157?clr=multi&colourWayId=203398176&cid=3602
AllSaints Glasco check overshirt in beige and brown with leopard print details,https://www.asos.com/allsaints/allsaints-glasco-check-overshirt-in-beige-and-brown-with-leopard-print-details/prd/203413215?clr=beige&colourWayId=203413225&cid=3602
AllSaints Weedport long sleeve check shirt in brown,https://www.asos.com/allsaints/allsaints-weedport-long-sleeve-check-shirt-in-brown/prd/203413657?clr=brown&colourWayId=203413659&cid=3602
ASOS DESIGN regular sheer shirt with western satin yoke in mink,https://www.asos.com/asos-design/asos-design-regular-sheer-shirt-with-western-satin-yoke-in-mink/prd/203438816?clr=mink&colourWayId=203438822&cid=3602
Dickies Coaling check flannel shirt in khaki,https://www.asos.com/dickies/dickies-coaling-check-flannel-shirt-in-khaki/prd/203461788?clr=khaki&colourWayId=203461810&cid=3602
Dickies Westover shirt in white/green,https://www.asos.com/dickies/dickies-westover-shirt-in-white-green/prd/203461995?clr=green&colourWayId=203462050&cid=3602
Weekday coffee oversized snake printed shirt in purple,https://www.asos.com/weekday/weekday-coffee-oversized-snake-printed-shirt-in-purple/prd/203575539?clr=purple&colourWayId=203575547&cid=3602
ASOS DESIGN boxy oversized satin shirt with wide revere collar in orange,https://www.asos.com/asos-design/asos-design-boxy-oversized-satin-shirt-with-wide-revere-collar-in-orange/prd/203623069?clr=orange&colourWayId=203623074&cid=3602
Liquor N Poker oversized long sleeve shirt in brown check,https://www.asos.com/liquor-n-poker/liquor-n-poker-oversized-long-sleeve-shirt-in-brown-check/prd/203628370?clr=brown&colourWayId=203628371&cid=3602
River Island borg paisley shirt in white,https://www.asos.com/river-island/river-island-borg-paisley-shirt-in-white/prd/203662446?clr=white&colourWayId=203662455&cid=3602
ASOS DESIGN oversized boxy jersey jacket in soft white,https://www.asos.com/asos-design/asos-design-oversized-boxy-jersey-jacket-in-soft-white/prd/203681121?clr=whisper-white&colourWayId=203681124&cid=3602
Twisted Tailor amoros check shirt in black,https://www.asos.com/twisted-tailor/twisted-tailor-amoros-check-shirt-in-black/prd/203701328?clr=multi&colourWayId=203701335&cid=3602
Twisted Tailor shackley slim shirt in navy mesh with leopard print,https://www.asos.com/twisted-tailor/twisted-tailor-shackley-slim-shirt-in-navy-mesh-with-leopard-print/prd/203702047?clr=navy&colourWayId=203702143&cid=3602
COLLUSION short sleeve satin shirt in brown and black print,https://www.asos.com/collusion/collusion-short-sleeve-satin-shirt-in-brown-and-black-print/prd/203717085?clr=black&colourWayId=203717091&cid=3602
COLLUSION textured relaxed short sleeve shirt in khaki,https://www.asos.com/collusion/collusion-textured-relaxed-short-sleeve-shirt-in-khaki/prd/203717179?clr=khaki&colourWayId=203717187&cid=3602
Selected Homme loose fit brushed overshirt in khaki,https://www.asos.com/selected-homme/selected-homme-loose-fit-brushed-overshirt-in-khaki/prd/203730827?clr=dark-olive&colourWayId=203730834&cid=3602
ASOS DESIGN oversized western jacket in green wavey print,https://www.asos.com/asos-design/asos-design-oversized-western-jacket-in-green-wavey-print/prd/203738548?clr=mid-green&colourWayId=203738549&cid=3602
Karl Kani serif pinstripe baseball shirt in green,https://www.asos.com/karl-kani/karl-kani-serif-pinstripe-baseball-shirt-in-green/prd/203757244?clr=green&colourWayId=203757251&cid=3602
ADPT oversized heavy brushed check overshirt beige & black,https://www.asos.com/adpt/adpt-oversized-heavy-brushed-check-overshirt-beige-black/prd/203798407?clr=fungi-black&colourWayId=203798420&cid=3602
Lee label logo twill utlity shirt relaxed fit in dark green,https://www.asos.com/lee/lee-label-logo-twill-utlity-shirt-relaxed-fit-in-dark-green/prd/203839631?clr=dark-green&colourWayId=203839635&cid=3602
TSTM Unisex Premium Limited Edition stripe double layer shirt in blue,https://www.asos.com/topman/tstm-unisex-premium-limited-edition-stripe-double-layer-shirt-in-blue/prd/203854153?clr=multi&colourWayId=203854154&cid=3602
Only & Sons revere collar long sleeve shirt in black geo print,https://www.asos.com/only-sons/only-sons-revere-collar-long-sleeve-shirt-in-black-geo-print/prd/203860845?clr=black&colourWayId=203860846&cid=3602
Only & Sons revere collar long sleeve shirt in black rose print,https://www.asos.com/only-sons/only-sons-revere-collar-long-sleeve-shirt-in-black-rose-print/prd/203861038?clr=black&colourWayId=203861039&cid=3602
Selected Homme check shirt in navy,https://www.asos.com/selected-homme/selected-homme-check-shirt-in-navy/prd/203878848?clr=dark-sapphire&colourWayId=203878880&cid=3602
ASOS DESIGN skinny denim shirt with western detail,https://www.asos.com/asos-design/asos-design-skinny-denim-shirt-with-western-detail/prd/203917394?clr=light-blue-wash&colourWayId=203917396&cid=3602
ASOS DESIGN boxy oversized shirt in linen mix spray print,https://www.asos.com/asos-design/asos-design-boxy-oversized-shirt-in-linen-mix-spray-print/prd/203927985?clr=multi&colourWayId=203927992&cid=3602
ASOS DESIGN colour block shirt in sheer crepe with contrast neck tie in  white,https://www.asos.com/asos-design/asos-design-colour-block-shirt-in-sheer-crepe-with-contrast-neck-tie-in-white/prd/203942090?clr=white&colourWayId=203942092&cid=3602
Lyle & Scott Vintage needle cord long sleeve shirt in dust mauve,https://www.asos.com/lyle-scott/lyle-scott-vintage-needle-cord-long-sleeve-shirt-in-dust-mauve/prd/204012472?clr=purple&colourWayId=204012475&cid=3602
Calvin Klein Jeans linear logo relaxed fit denim shirt in mid wash,https://www.asos.com/calvin-klein-jeans/calvin-klein-jeans-linear-logo-relaxed-fit-denim-shirt-in-mid-wash/prd/204035812?clr=denim-dark&colourWayId=204035816&cid=3602
Calvin Klein Jeans monologo badge relaxed fit overshirt in tan,https://www.asos.com/calvin-klein-jeans/calvin-klein-jeans-monologo-badge-relaxed-fit-overshirt-in-tan/prd/204035878?clr=warm-toffee&colourWayId=204035881&cid=3602
Tommy Hilfiger mini tartan shirt in blue multi,https://www.asos.com/tommy-hilfiger/tommy-hilfiger-mini-tartan-shirt-in-blue-multi/prd/204046457?clr=navy-blue-multi&colourWayId=204046467&cid=3602
Tommy Hilfiger twill shacket in tan,https://www.asos.com/tommy-hilfiger/tommy-hilfiger-twill-shacket-in-tan/prd/204046676?clr=countryside-khaki&colourWayId=204046685&cid=3602
Bershka oversized poplin shirt in black,https://www.asos.com/bershka/bershka-oversized-poplin-shirt-in-black/prd/204060997?clr=black&colourWayId=204060999&cid=3602
Barbour International Link plain overshirt in yellow,https://www.asos.com/barbour-international/barbour-international-link-plain-overshirt-in-yellow/prd/204081620?clr=yellow&colourWayId=204081637&cid=3602
Dr Denim relaxed fit striped long sleeve shirt in blue and white,https://www.asos.com/dr-denim/dr-denim-relaxed-fit-striped-long-sleeve-shirt-in-blue-and-white/prd/204098011?clr=blue&colourWayId=204098012&cid=3602
Bershka motorcross shirt in black,https://www.asos.com/bershka/bershka-motorcross-shirt-in-black/prd/204122018?clr=black&colourWayId=204122049&cid=3602
Topman faces printed shirt in multi,https://www.asos.com/topman/topman-faces-printed-shirt-in-multi/prd/204132496?clr=multi&colourWayId=204132507&cid=3602
Topman geo border satin printed shirt in multi,https://www.asos.com/topman/topman-geo-border-satin-printed-shirt-in-multi/prd/204134728?clr=multi&colourWayId=204134735&cid=3602
Guess Originals co-ord patchwork zip up shirt jacket in multi,https://www.asos.com/guess-originals/guess-originals-co-ord-patchwork-zip-up-shirt-jacket-in-multi/prd/204145264?clr=jblk-jet-blac&colourWayId=204145274&cid=3602
PS Paul Smith logo short sleeve shirt in pale green,https://www.asos.com/ps-paul-smith/ps-paul-smith-logo-short-sleeve-shirt-in-pale-green/prd/204235969?clr=green&colourWayId=204235978&cid=3602
Lacoste large logo relaxed fit long sleeve shirt in green stripe,https://www.asos.com/lacoste/lacoste-large-logo-relaxed-fit-long-sleeve-shirt-in-green-stripe/prd/204282678?clr=green&colourWayId=204282710&cid=3602
Calvin Klein Jeans badge logo long sleeve shirt in beige,https://www.asos.com/calvin-klein-jeans/calvin-klein-jeans-badge-logo-long-sleeve-shirt-in-beige/prd/204315326?clr=travertine&colourWayId=204315376&cid=3602
BOSS Orange Rickert striped long sleeve shirt in navy,https://www.asos.com/boss-by-hugo-boss/boss-orange-rickert-striped-long-sleeve-shirt-in-navy/prd/204317427?clr=navy&colourWayId=204317436&cid=3602
HUGO Ebase relaxed fit baseball style short sleeve shirt in white,https://www.asos.com/hugo/hugo-ebase-relaxed-fit-baseball-style-short-sleeve-shirt-in-white/prd/204319295?clr=white&colourWayId=204319304&cid=3602
Lee cord overshirt in washed beige,https://www.asos.com/lee/lee-cord-overshirt-in-washed-beige/prd/204328730?clr=caramel&colourWayId=204328734&cid=3602
Carhartt WIP skyler quilted overshirt in green,https://www.asos.com/carhartt-wip/carhartt-wip-skyler-quilted-overshirt-in-green/prd/204360225?clr=green&colourWayId=204360249&cid=3602
Hollister check flannel shirt in green,https://www.asos.com/hollister/hollister-check-flannel-shirt-in-green/prd/204363826?clr=tan&colourWayId=204363834&cid=3602
ASOS DESIGN extreme oversized shacket in blue,https://www.asos.com/asos-design/asos-design-extreme-oversized-shacket-in-blue/prd/204371757?clr=blue&colourWayId=204371784&cid=3602
Abercrombie & Fitch faux suede zip front shirt jacket in black,https://www.asos.com/abercrombie-fitch/abercrombie-fitch-faux-suede-zip-front-shirt-jacket-in-black/prd/204398251?clr=black&colourWayId=204398252&cid=3602
Sixth June plisse shirt in blue,https://www.asos.com/sixth-june/sixth-june-plisse-sets-in-blue/grp/204973063?clr=blue&colourWayId=204445430&cid=3602#204445422
Dickies warrenton check shirt in dark brown,https://www.asos.com/dickies/dickies-warrenton-check-shirt-in-dark-brown/prd/204456346?clr=dark-brown&colourWayId=204456363&cid=3602
ASOS DESIGN relaxed revere linen look shirt in Hokusai print,https://www.asos.com/asos-design/asos-design-relaxed-revere-linen-look-shirt-in-hokusai-print/prd/204538266?clr=white&colourWayId=204538273&cid=3602
River Island long sleeve check shirt in ecru,https://www.asos.com/river-island/river-island-long-sleeve-check-shirt-in-ecru/prd/204547122?clr=ecru&colourWayId=204547123&cid=3602
Abercrombie & Fitch logo short sleeve oxford shirt in navy,https://www.asos.com/abercrombie-fitch/abercrombie-fitch-logo-short-sleeve-oxford-shirt-in-navy/prd/204568440?clr=navy&colourWayId=204568443&cid=3602
ellesse Capri co-ord shirt with lightning bolt print in beige,https://www.asos.com/ellesse/ellesse-capri-co-ord-shirt-with-lightning-bolt-print-in-beige/prd/204640188?clr=beige&colourWayId=204640189&cid=3602
Lyle & Scott icon logo slim fit poplin shirt in white,https://www.asos.com/lyle-scott/lyle-scott-icon-logo-slim-fit-poplin-shirt-in-white/prd/204788228?clr=white&colourWayId=204788229&cid=3602
River Island short sleeve revere embroidery shirt in rust,https://www.asos.com/river-island/river-island-short-sleeve-revere-embroidery-shirt-in-rust/prd/204814443?clr=rust&colourWayId=204814483&cid=3602
Reclaimed Vintage inspired unisex leather look croc shacket in stone,https://www.asos.com/reclaimed-vintage/reclaimed-vintage-inspired-unisex-leather-look-croc-shacket-in-stone/prd/24555945?clr=stone&colourWayId=60592718&cid=3602
Obey connect shirt in beige,https://www.asos.com/obey/obey-connect-shirt-in-beige/prd/204617194?clr=beige&colourWayId=204617222&cid=3602
Obey pensa velour polo shirt in green,https://www.asos.com/obey/obey-pensa-velour-polo-shirt-in-green/prd/204616863?clr=green&colourWayId=204616889&cid=3602
Obey slither shirt in white,https://www.asos.com/obey/obey-slither-shirt-in-white/prd/204616864?clr=white&colourWayId=204616891&cid=3602
Topman short sleeve cafe shirt in multi,https://www.asos.com/topman/topman-short-sleeve-cafe-shirt-in-multi/prd/204389708?clr=multi&colourWayId=204389710&cid=3602
Topman oversize watercolour check shirt in stone and blue,https://www.asos.com/topman/topman-oversize-watercolour-check-shirt-in-stone-and-blue/prd/200237221?clr=blue&colourWayId=200237231&cid=3602
ASOS DESIGN relaxed revere linen mix shirt in scenic print,https://www.asos.com/asos-design/asos-design-relaxed-revere-linen-mix-shirt-in-scenic-print/prd/202096958?clr=multi&colourWayId=202096967&cid=3602
Topman textured button down jacket in khaki,https://www.asos.com/topman/topman-textured-button-down-jacket-in-khaki/prd/202172461?clr=khaki&colourWayId=202172470&cid=3602
ASOS DESIGN faux leather shacket in embossed brown snake print,https://www.asos.com/asos-design/asos-design-faux-leather-shacket-in-embossed-brown-snake-print/prd/202222307?clr=brown&colourWayId=202222308&cid=3602
ASOS DESIGN Premium slim fit sateen shirt with shawl collar in white,https://www.asos.com/asos-design/asos-design-premium-slim-fit-sateen-shirt-with-shawl-collar-in-white/prd/202369831?clr=white&colourWayId=202369846&cid=3602
Topman quilted overshirt with hood in khaki,https://www.asos.com/topman/topman-quilted-overshirt-with-hood-in-khaki/prd/202592619?clr=khaki&colourWayId=202592625&cid=3602
ASOS DESIGN regular lace shirt with ruffle front in white,https://www.asos.com/asos-design/asos-design-regular-lace-shirt-with-ruffle-front-in-white/prd/202659380?clr=white&colourWayId=202659386&cid=3602
COLLUSION Unisex Y2K poplin oversized shirt in multi stripe,https://www.asos.com/collusion/collusion-unisex-y2k-poplin-oversized-shirt-in-multi-stripe/prd/202671775?clr=multi&colourWayId=202671788&cid=3602
ASOS DESIGN oversized western jacket in check,https://www.asos.com/asos-design/asos-design-oversized-western-jacket-in-check/prd/202955456?clr=grey&colourWayId=202955469&cid=3602
ASOS DESIGN oversized velvet shirt in red,https://www.asos.com/asos-design/asos-design-oversized-velvet-shirt-in-red/prd/202960298?clr=red&colourWayId=202960300&cid=3602
Topman oversized check shirt with embroidery in green,https://www.asos.com/topman/topman-oversized-check-shirt-with-embroidery-in-green/prd/203062196?clr=green&colourWayId=203062197&cid=3602
ASOS DESIGN dropped shoulder oversized revere shirt in retro stripe,https://www.asos.com/asos-design/asos-design-dropped-shoulder-oversized-revere-shirt-in-retro-stripe/prd/203095636?clr=multi&colourWayId=203095638&cid=3602
ASOS DESIGN wool mix check shacket in brown,https://www.asos.com/asos-design/asos-design-wool-mix-check-shacket-in-brown/prd/203133384?clr=brown&colourWayId=203133386&cid=3602
Devils Advocate long sleeve shirt in red and navy stripe,https://www.asos.com/devils-advocate/devils-advocate-long-sleeve-shirt-in-red-and-navy-stripe/prd/203261105?clr=red&colourWayId=203261106&cid=3602
ASOS DESIGN oversized faux suede shirt in cobalt blue,https://www.asos.com/asos-design/asos-design-oversized-faux-suede-shirt-in-cobalt-blue/prd/203292224?clr=cobalt-blue&colourWayId=203292226&cid=3602
Dickies Evansville long sleeve shirt in black,https://www.asos.com/dickies/dickies-evansville-long-sleeve-shirt-in-black/prd/203370276?clr=black&colourWayId=203370277&cid=3602
Carhartt WIP bowman stripe shirt in green,https://www.asos.com/carhartt-wip/carhartt-wip-bowman-stripe-shirt-in-green/prd/203402303?clr=green&colourWayId=203402397&cid=3602
Carhartt WIP wiston overshirt in brown,https://www.asos.com/carhartt-wip/carhartt-wip-wiston-overshirt-in-brown/prd/203403101?clr=brown&colourWayId=203403194&cid=3602
AllSaints Edenwald check overshirt in ecru,https://www.asos.com/allsaints/allsaints-edenwald-check-overshirt-in-ecru/prd/203413656?clr=white&colourWayId=203413660&cid=3602
ASOS DESIGN sheer shirt with pleat front & contrast neck tie in mint,https://www.asos.com/asos-design/asos-design-sheer-shirt-with-pleat-front-contrast-neck-tie-in-mint/prd/203438722?clr=mint&colourWayId=203438724&cid=3602
ASOS DESIGN relaxed revere satin shirt in jewel print,https://www.asos.com/asos-design/asos-design-relaxed-revere-satin-shirt-in-jewel-print/prd/203490518?clr=multi&colourWayId=203490522&cid=3602
Polo Ralph Lauren snow traverse print fine cord shirt classic fit in multi,https://www.asos.com/polo-ralph-lauren/polo-ralph-lauren-snow-traverse-print-fine-cord-shirt-classic-fit-in-multi/prd/203491216?clr=multi&colourWayId=203491221&cid=3602
Only & Sons wool check jacket with quilted lining in brown,https://www.asos.com/only-sons/only-sons-wool-check-jacket-with-quilted-lining-in-brown/prd/203556431?clr=seal-brown&colourWayId=203556432&cid=3602
ASOS DESIGN textured tinsel shirt with revere collar in soft pink,https://www.asos.com/asos-design/asos-design-textured-tinsel-shirt-with-revere-collar-in-soft-pink/prd/203574685?clr=pink&colourWayId=203574694&cid=3602
ASOS DESIGN oversized velvet shirt in burgundy with double pockets,https://www.asos.com/asos-design/asos-design-oversized-velvet-shirt-in-burgundy-with-double-pockets/prd/203577005?clr=burgundy&colourWayId=203577024&cid=3602
Lyle & Scott Archive cord zip overshirt in navy,https://www.asos.com/lyle-scott/lyle-scott-archive-cord-zip-overshirt-in-navy/prd/203580411?clr=navy&colourWayId=203580418&cid=3602
COLLUSION check & camo oversized patchwork shirt co-ord in khaki,https://www.asos.com/collusion/collusion-check-camo-oversized-patchwork-shirt-co-ord-in-khaki/prd/203657928?clr=khaki&colourWayId=203657930&cid=3602
Twisted Tailor torrance slim shirt in black with waves flocking,https://www.asos.com/twisted-tailor/twisted-tailor-torrance-slim-shirt-in-black-with-waves-flocking/prd/203701341?clr=black&colourWayId=203701453&cid=3602
Weekday noel oversized jersey shirt in brown,https://www.asos.com/weekday/weekday-noel-oversized-jersey-shirt-in-brown/prd/203708296?clr=brown&colourWayId=203708304&cid=3602
Topman patchwork overshirt in black and white,https://www.asos.com/topman/topman-patchwork-overshirt-in-black-and-white/prd/203720549?clr=black-and-white&colourWayId=203720558&cid=3602
ASOS DESIGN boxy oversized revere satin shirt in kaleidoscope floral print,https://www.asos.com/asos-design/asos-design-boxy-oversized-revere-satin-shirt-in-kaleidoscope-floral-print/prd/203747112?clr=multi&colourWayId=203747113&cid=3602
ASOS DESIGN 90s oversized purple check shirt with bleached hem,https://www.asos.com/asos-design/asos-design-90s-oversized-purple-check-shirt-with-bleached-hem/prd/203749758?clr=purple&colourWayId=203749759&cid=3602
Lee riveted relaxed fit denim shirt in light wash,https://www.asos.com/lee/lee-riveted-relaxed-fit-denim-shirt-in-light-wash/prd/203839179?clr=space-blue&colourWayId=203839211&cid=3602
Calvin Klein Jeans monologo badge corduroy shirt in camel,https://www.asos.com/calvin-klein-jeans/calvin-klein-jeans-monologo-badge-corduroy-shirt-in-camel/prd/203857472?clr=camel&colourWayId=203857477&cid=3602
Selected Homme check shirt in beige,https://www.asos.com/selected-homme/selected-homme-check-shirt-in-beige/prd/203879060?clr=oatmeal&colourWayId=203879079&cid=3602
Polo Ralph Lauren icon logo multi stripe oxford shirt custom regular fit in orange/green multi,https://www.asos.com/polo-ralph-lauren/polo-ralph-lauren-icon-logo-multi-stripe-oxford-shirt-custom-regular-fit-in-orange-green-multi/prd/203890896?clr=orange-green-multi&colourWayId=203890906&cid=3602
Polo Ralph Lauren slim fit oxford shirt with pony logo in yellow,https://www.asos.com/polo-ralph-lauren/polo-ralph-lauren-slim-fit-oxford-shirt-with-pony-logo-in-yellow/prd/203912919?clr=yellow&colourWayId=203912920&cid=3602
River Island PU overshirt in red,https://www.asos.com/river-island/river-island-pu-overshirt-in-red/prd/203917039?clr=red&colourWayId=203917044&cid=3602
ASOS DESIGN dropped shoulder oversized revere satin shirt with placement print,https://www.asos.com/asos-design/asos-design-dropped-shoulder-oversized-revere-satin-shirt-with-placement-print/prd/203927998?clr=multi&colourWayId=203928005&cid=3602
Barbour Ivor zip overshirt in grey,https://www.asos.com/barbour/barbour-ivor-zip-overshirt-in-grey/prd/203940564?clr=grey&colourWayId=203940566&cid=3602
Fred Perry tartan panel shirt in black,https://www.asos.com/fred-perry/fred-perry-tartan-panel-shirt-in-black/prd/203985372?clr=black&colourWayId=203985407&cid=3602
