description,url
Vans brickett shirt jacket in black,https://www.asos.com/vans/vans-brickett-shirt-jacket-in-black/prd/203225753?clr=black&colourWayId=203225756&cid=3602
Devils Advocate check borg shacket in green,https://www.asos.com/devils-advocate/devils-advocate-check-borg-shacket-in-green/prd/203262610?clr=mid-green&colourWayId=203262611&cid=3602
River Island 1 pocket short sleeve shirt in light grey,https://www.asos.com/river-island/river-island-1-pocket-short-sleeve-shirt-in-light-grey/prd/203330355?clr=grey-light&colourWayId=203330358&cid=3602
Topman revere velvet shirt in dark green,https://www.asos.com/topman/topman-revere-velvet-shirt-in-dark-green/prd/203378195?clr=black-and-white&colourWayId=203378201&cid=3602
Carhartt WIP  whitsome corduroy shacket in black,https://www.asos.com/carhartt-wip/carhartt-wip-whitsome-corduroy-shacket-in-black/prd/203401964?clr=black&colourWayId=203402080&cid=3602
Carhartt WIP  whitsome corduroy shacket in green,https://www.asos.com/carhartt-wip/carhartt-wip-whitsome-corduroy-shacket-in-green/prd/203402764?clr=green&colourWayId=203402821&cid=3602
Tommy Jeans check sherpa flannel  overshirt in white/black,https://www.asos.com/tommy-jeans/tommy-jeans-check-sherpa-flannel-overshirt-in-white-black/prd/203516414?clr=white-black&colourWayId=203516427&cid=3602
AllSaints Spotter military shirt in cargo green,https://www.asos.com/allsaints/allsaints-spotter-military-shirt-in-cargo-green/prd/203595719?clr=cargo-green&colourWayId=203595720&cid=3602
GANT tartan check regular fit brushed oxford shirt in cream,https://www.asos.com/gant/gant-tartan-check-regular-fit-brushed-oxford-shirt-in-cream/prd/203607387?clr=cream&colourWayId=203607422&cid=3602
Armani Exchange large logo shirt in white,https://www.asos.com/armani-exchange/armani-exchange-large-logo-shirt-in-white/prd/203660019?clr=white&colourWayId=203660050&cid=3602
Twisted Tailor platini shirt in multi,https://www.asos.com/twisted-tailor/twisted-tailor-platini-shirt-in-multi/prd/203701690?clr=multi&colourWayId=203701712&cid=3602
ASOS DESIGN relaxed revere shirt with Mean Girls back print,https://www.asos.com/asos-design/asos-design-relaxed-revere-shirt-with-mean-girls-back-print/prd/203944418?clr=multi&colourWayId=203944440&cid=3602
Fred Perry brushed cotton check shirt in red,https://www.asos.com/fred-perry/fred-perry-brushed-cotton-check-shirt-in-red/prd/203985681?clr=red&colourWayId=203985696&cid=3602
Lyle & Scott Vintage check fleece overshirt in navy,https://www.asos.com/lyle-scott/lyle-scott-vintage-check-fleece-overshirt-in-navy/prd/204012473?clr=navy&colourWayId=204012476&cid=3602
Calvin Klein Jeans monologo badge oversized fit knitted shirt in white marl,https://www.asos.com/calvin-klein-jeans/calvin-klein-jeans-monologo-badge-oversized-fit-knitted-shirt-in-white-marl/prd/204035895?clr=white-grey-heather&colourWayId=204035901&cid=3602
Calvin Klein Jeans utility cargo relaxed fit overshirt in beige,https://www.asos.com/calvin-klein-jeans/calvin-klein-jeans-utility-cargo-relaxed-fit-overshirt-in-beige/prd/204035943?clr=travertine&colourWayId=204035951&cid=3602
Armani Exchange logo print shirt in black,https://www.asos.com/armani-exchange/armani-exchange-logo-print-shirt-in-black/prd/204133083?clr=black&colourWayId=204133090&cid=3602
Calvin Klein badge logo overshirt in beige,https://www.asos.com/calvin-klein/calvin-klein-badge-logo-overshirt-in-beige/prd/204277195?clr=stony-beige&colourWayId=204277203&cid=3602
Dickies clintondale logo short sleeve work shirt in white,https://www.asos.com/dickies/dickies-clintondale-logo-short-sleeve-work-shirt-in-white/prd/204456262?clr=white&colourWayId=204456283&cid=3602
ASOS DESIGN extreme oversized patchwork shirt in neutral,https://www.asos.com/asos-design/asos-design-extreme-oversized-patchwork-shirt-in-neutral/prd/200409083?clr=stone&colourWayId=200409084&cid=3602
ASOS DESIGN regular shirt with lace collar in white,https://www.asos.com/asos-design/asos-design-regular-shirt-with-lace-collar-in-white/prd/200823380?clr=white&colourWayId=200823381&cid=3602
ASOS DESIGN relaxed revere shirt in sheer with sparkle embroidery,https://www.asos.com/asos-design/asos-design-relaxed-revere-shirt-in-sheer-with-sparkle-embroidery/prd/201866850?clr=black&colourWayId=201866882&cid=3602
ASOS DESIGN real leather shacket in red,https://www.asos.com/asos-design/asos-design-real-leather-shacket-in-red/prd/202188616?clr=red&colourWayId=202188618&cid=3602
ASOS DESIGN relaxed shirt in yellow and lime hand painted check,https://www.asos.com/asos-design/asos-design-relaxed-shirt-in-yellow-and-lime-hand-painted-check/prd/202249066?clr=yellow&colourWayId=202249088&cid=3602
ASOS DESIGN wool look harrington jacket in black and white check,https://www.asos.com/asos-design/asos-design-wool-look-harrington-jacket-in-black-and-white-check/prd/202257800?clr=multi&colourWayId=202257808&cid=3602
Topman 90's oversized shirt in landscape print,https://www.asos.com/topman/topman-90s-oversized-shirt-in-landscape-print/prd/202425942?clr=green-and-blue-print&colourWayId=202425952&cid=3602
ASOS DESIGN dropped shoulder oversized revere shirt in bright floral print,https://www.asos.com/asos-design/asos-design-dropped-shoulder-oversized-revere-shirt-in-bright-floral-print/prd/202579461?clr=multi&colourWayId=202579463&cid=3602
Hugo Ellino leaf print short sleeve shirt in White,https://www.asos.com/hugo/hugo-ellino-leaf-print-short-sleeve-shirt-in-white/prd/202710100?clr=white&colourWayId=202710103&cid=3602
Farah Austin check long sleeve cotton shirt in lilac,https://www.asos.com/farah/farah-austin-check-long-sleeve-cotton-shirt-in-lilac/prd/202970019?clr=purple&colourWayId=202970044&cid=3602
BOSS Orange denim acid wash overshirt in washed black,https://www.asos.com/boss-by-hugo-boss/boss-orange-denim-acid-wash-overshirt-in-washed-black/prd/203001791?clr=black&colourWayId=203001792&cid=3602
G-star short sleeve denim shirt in blue,https://www.asos.com/g-star/g-star-short-sleeve-denim-shirt-in-blue/prd/203128771?clr=blue&colourWayId=203128773&cid=3602
BOSS Orange Lovvo denim shirt in dark blue,https://www.asos.com/boss-by-hugo-boss/boss-orange-lovvo-denim-shirt-in-dark-blue/prd/203366994?clr=navy&colourWayId=203366998&cid=3602
Versace Jeans Couture tapestry shirt in beige,https://www.asos.com/versace-jeans-couture/versace-jeans-couture-tapestry-shirt-in-beige/prd/203379449?clr=beige&colourWayId=203379469&cid=3602
Polo Ralph Lauren icon logo slim fit check sanded twill shirt in red/black,https://www.asos.com/polo-ralph-lauren/polo-ralph-lauren-icon-logo-slim-fit-check-sanded-twill-shirt-in-red-black/prd/203491380?clr=red-black&colourWayId=203491397&cid=3602
Polo Ralph Lauren icon logo custom fit check poplin dress shirt in green/navy,https://www.asos.com/polo-ralph-lauren/polo-ralph-lauren-icon-logo-custom-fit-check-poplin-dress-shirt-in-green-navy/prd/203491800?clr=green-navy&colourWayId=203491801&cid=3602
Barbour Stanford slim fit tartan check shirt in multi,https://www.asos.com/barbour/barbour-stanford-slim-fit-tartan-check-shirt-in-multi/prd/203535558?clr=multi&colourWayId=203535601&cid=3602
GANT check heavy twill overshirt in burgundy,https://www.asos.com/gant/gant-check-heavy-twill-overshirt-in-burgundy/prd/203607444?clr=burgundy&colourWayId=203607485&cid=3602
Armani Exchange camo print shirt in beige,https://www.asos.com/armani-exchange/armani-exchange-camo-print-shirt-in-beige/prd/203659660?clr=beige&colourWayId=203659674&cid=3602
Twisted Tailor dembele printed shirt in dark brown,https://www.asos.com/twisted-tailor/twisted-tailor-dembele-printed-shirt-in-dark-brown/prd/203702152?clr=beige&colourWayId=203702168&cid=3602
Obey disco duck crew sweatshirt in light purple,https://www.asos.com/obey/obey-disco-duck-crew-sweatshirt-in-light-purple/prd/203710613?clr=purple&colourWayId=203710614&cid=3602
Element Lumberjack shirt in navy/ white check,https://www.asos.com/element/element-lumberjack-shirt-in-navy-white-check/prd/203732214?clr=navy&colourWayId=203732232&cid=3602
Element Lumberjack shirt in burgundy/ purple check,https://www.asos.com/element/element-lumberjack-shirt-in-burgundy-purple-check/prd/203732359?clr=burgundy&colourWayId=203732374&cid=3602
Calvin Klein check flannel shirt in black,https://www.asos.com/calvin-klein/calvin-klein-check-flannel-shirt-in-black/prd/203740411?clr=black&colourWayId=203740414&cid=3602
Karl Kani varsity baseball shirt in black,https://www.asos.com/karl-kani/karl-kani-varsity-baseball-shirt-in-black/prd/203757154?clr=multi&colourWayId=203757161&cid=3602
Stan Ray cpo shirt in camo,https://www.asos.com/stan-ray/stan-ray-cpo-shirt-in-camo/prd/203766661?clr=multi&colourWayId=203766677&cid=3602
Lee tab pocket logo regular fit chambray shirt buttondown in white,https://www.asos.com/lee/lee-tab-pocket-logo-regular-fit-chambray-shirt-buttondown-in-white/prd/203839623?clr=white&colourWayId=203839624&cid=3602
Calvin Klein Jeans monologo badge corduroy shirt in black,https://www.asos.com/calvin-klein-jeans/calvin-klein-jeans-monologo-badge-corduroy-shirt-in-black/prd/203857268?clr=black&colourWayId=203857284&cid=3602
Polo Ralph Lauren icon logo stripe poplin shirt custom regular fit button down in khaki tan,https://www.asos.com/polo-ralph-lauren/polo-ralph-lauren-icon-logo-stripe-poplin-shirt-custom-regular-fit-button-down-in-khaki-tan/prd/203890026?clr=khaki-tan&colourWayId=203890042&cid=3602
Polo Ralph Lauren icon logo brushed flannel shirt custom regular fit in army green,https://www.asos.com/polo-ralph-lauren/polo-ralph-lauren-icon-logo-brushed-flannel-shirt-custom-regular-fit-in-army-green/prd/203890809?clr=army-green&colourWayId=203890822&cid=3602
Weekday wool blend curtis checked overshirt in brown,https://www.asos.com/weekday/weekday-wool-blend-curtis-checked-overshirt-in-brown/prd/204063426?clr=brown&colourWayId=204063428&cid=3602
Pretty Green Cester leopard print overshirt in grey,https://www.asos.com/pretty-green/pretty-green-cester-leopard-print-overshirt-in-grey/prd/204078751?clr=black&colourWayId=204078781&cid=3602
Farah Saudan all over print long sleeve cotton shirt in true navy,https://www.asos.com/farah/farah-saudan-all-over-print-long-sleeve-cotton-shirt-in-true-navy/prd/204111026?clr=navy&colourWayId=204111037&cid=3602
Levi's Skate cord overshirt in red with pockets,https://www.asos.com/levis-skateboarding/levis-skate-cord-overshirt-in-red-with-pockets/prd/204423139?clr=raspberry&colourWayId=204423141&cid=3602
Weekday Unisex oversized short sleeve resort shirt in grey exclusive to ASOS,https://www.asos.com/weekday/weekday-unisex-oversized-short-sleeve-resort-shirt-in-grey-exclusive-to-asos/prd/204719968?clr=grey&colourWayId=204719969&cid=3602
ASOS DESIGN 90s oversized colour block cord shirt in pink,https://www.asos.com/asos-design/asos-design-90s-oversized-colour-block-cord-shirt-in-pink/prd/24513687?clr=pink&colourWayId=60589226&cid=3602
Lacoste front print check long sleeve unisex shirt in black,https://www.asos.com/lacoste/lacoste-front-print-check-long-sleeve-unisex-shirt-in-black/prd/203306118?clr=black&colourWayId=203306141&cid=3602
Sixth June revere collared shirt in black with all over logo print,https://www.asos.com/sixth-june/sixth-june-all-over-logo-print-set-in-black/grp/104581?clr=black&colourWayId=201844526&cid=3602#201844516
ASOS DESIGN relaxed revere linen mix shirt in white with floral border,https://www.asos.com/asos-design/asos-design-relaxed-revere-linen-mix-shirt-in-white-with-floral-border/prd/202374881?clr=white&colourWayId=202374883&cid=3602
ASOS DESIGN regular sheer shirt with embroidered sequin detail in black,https://www.asos.com/asos-design/asos-design-regular-sheer-shirt-with-embroidered-sequin-detail-in-black/prd/203574629?clr=black&colourWayId=203574631&cid=3602
Topman short sleeve textured shirt in sage,https://www.asos.com/topman/topman-short-sleeve-textured-shirt-in-sage/prd/204385587?clr=sage&colourWayId=204385595&cid=3602
Polo Ralph Lauren Big & Tall pique shirt with pony logo in navy,https://www.asos.com/polo-ralph-lauren/polo-ralph-lauren-big-tall-pique-shirt-with-pony-logo-in-navy/prd/202837714?clr=navy&colourWayId=202837715&cid=3602
Polo Ralph Lauren Big & Tall bear logo oxford shirt classic fit in white,https://www.asos.com/polo-ralph-lauren/polo-ralph-lauren-big-tall-bear-logo-oxford-shirt-classic-fit-in-white/prd/204557399?clr=white&colourWayId=204557416&cid=3602
Polo Ralph Lauren Big & Tall icon logo oxford shirt in white,https://www.asos.com/polo-ralph-lauren/polo-ralph-lauren-big-tall-icon-logo-oxford-shirt-in-white/prd/201475297?clr=white&colourWayId=201475305&cid=3602
Polo Ralph Lauren Big & Tall icon logo revere collar short sleeve cotton terry shirt in navy CO-ORD,https://www.asos.com/polo-ralph-lauren/polo-ralph-lauren-big-tall-icon-logo-revere-collar-short-sleeve-cotton-terry-shirt-in-navy-co-ord/prd/204557141?clr=navy&colourWayId=204557174&cid=3602
Levi's Big & Tall Sunset Camp shirt in white print with pocket,https://www.asos.com/levis/levis-big-tall-sunset-camp-shirt-in-white-print-with-pocket/prd/204417298?clr=bright-white&colourWayId=204417305&cid=3602
Polo Ralph Lauren Big & Tall icon logo stripe oxford shirt classic fit in multi,https://www.asos.com/polo-ralph-lauren/polo-ralph-lauren-big-tall-icon-logo-stripe-oxford-shirt-classic-fit-in-multi/prd/204557338?clr=green-pink-multi&colourWayId=204557358&cid=3602
Tommy Jeans Big & Tall Chicago flag logo colourblock gilet in multi,https://www.asos.com/tommy-jeans/tommy-jeans-big-tall-chicago-flag-logo-colourblock-gilet-in-multi/prd/204310346?clr=navy-multi&colourWayId=204310349&cid=3602
Tommy Hilfiger Big & Tall corduroy overshirt in navy,https://www.asos.com/tommy-hilfiger/tommy-hilfiger-big-tall-corduroy-overshirt-in-navy/prd/203855705?clr=navy&colourWayId=203855713&cid=3602
Levi's Big & Tall relaxed fit western shirt in blue denim,https://www.asos.com/levis/levis-big-tall-relaxed-fit-western-shirt-in-blue-denim/prd/204417350?clr=chambray-light&colourWayId=204417357&cid=3602
Polo Ralph Lauren Big & Tall icon logo short sleeve seersucker shirt in white,https://www.asos.com/polo-ralph-lauren/polo-ralph-lauren-big-tall-icon-logo-short-sleeve-seersucker-shirt-in-white/prd/204557639?clr=white&colourWayId=204557655&cid=3602
Calvin Klein Big & Tall stretch slim shirt in black,https://www.asos.com/calvin-klein/calvin-klein-big-tall-stretch-slim-shirt-in-black/prd/202677881?clr=black&colourWayId=202677903&cid=3602
Polo Ralph Lauren Big & Tall multi icon denim shirt in denim,https://www.asos.com/polo-ralph-lauren/polo-ralph-lauren-big-tall-multi-icon-denim-shirt-in-denim/prd/203493795?clr=denim&colourWayId=203493802&cid=3602
Polo Ralph Lauren Big & Tall icon logo twill shirt classic fit in navy,https://www.asos.com/polo-ralph-lauren/polo-ralph-lauren-big-tall-icon-logo-twill-shirt-classic-fit-in-navy/prd/204557459?clr=navy&colourWayId=204557474&cid=3602
Polo Ralph Lauren Big & Tall icon logo short sleeve stripe seersucker shirt in dark indigo,https://www.asos.com/polo-ralph-lauren/polo-ralph-lauren-big-tall-icon-logo-short-sleeve-stripe-seersucker-shirt-in-dark-indigo/prd/204557675?clr=dark-indigo&colourWayId=204557689&cid=3602
ASOS DESIGN relaxed deep revere shirt in lightweight texture in white,https://www.asos.com/asos-design/asos-design-relaxed-deep-revere-shirt-in-lightweight-texture-in-white/prd/204366707?clr=white&colourWayId=204366709&cid=3602
ASOS DESIGN 90s oversized check shirt in blue,https://www.asos.com/asos-design/asos-design-90s-oversized-check-shirt-in-blue/prd/200310961?clr=blue&colourWayId=200310962&cid=3602
ASOS DESIGN co-ord relaxed revere shirt in aztec print,https://www.asos.com/asos-design/asos-design-co-ord-in-black-white-aztec-print/grp/204972570?clr=ecru&colourWayId=204269942&cid=3602#204269941
ASOS DESIGN cotton shacket in khaki,https://www.asos.com/asos-design/asos-design-cotton-shacket-in-khaki/prd/202820912?clr=khaki&colourWayId=202820913&cid=3602
ASOS DESIGN relaxed revere textured stripe shirt in orange,https://www.asos.com/asos-design/asos-design-relaxed-revere-textured-stripe-shirt-in-orange/prd/204138255?clr=orange&colourWayId=204138268&cid=3602
ASOS DESIGN oversized midweight knitted cotton button through polo in beige,https://www.asos.com/asos-design/asos-design-oversized-midweight-knitted-cotton-button-through-polo-in-beige/prd/204166562?clr=beige&colourWayId=204166572&cid=3602
ASOS DESIGN boxy oversized broidery shirt in tan,https://www.asos.com/asos-design/asos-design-boxy-oversized-broidery-shirt-in-tan/prd/204242171?clr=tan&colourWayId=204242180&cid=3602
ASOS DESIGN slim fit oxford shirt in dark sage green,https://www.asos.com/asos-design/asos-design-slim-fit-oxford-shirt-in-dark-sage-green/prd/202633311?clr=dark-sage&colourWayId=202633313&cid=3602
Topman floral embroidered shirt in ecru,https://www.asos.com/topman/topman-floral-embroidered-shirt-in-ecru/prd/204132494?clr=stone&colourWayId=204132497&cid=3602
Jack & Jones Essentials linen shirt in beige stripe,https://www.asos.com/jack-jones/jack-jones-essentials-linen-shirt-in-beige-stripe/prd/204246369?clr=crockery&colourWayId=204246378&cid=3602
ASOS DESIGN stretch slim fit work shirt in blue,https://www.asos.com/asos-design/asos-design-stretch-slim-fit-work-shirt-in-blue/prd/23632998?clr=blue&colourWayId=60499342&cid=3602
ASOS DESIGN cord overshirt in light khaki,https://www.asos.com/asos-design/asos-design-cord-overshirt-in-light-khaki/prd/202745304?clr=light-khaki&colourWayId=202745330&cid=3602
ASOS DESIGN relaxed deep revere shirt in crochet lace pattern,https://www.asos.com/asos-design/asos-design-relaxed-deep-revere-shirt-in-crochet-lace-pattern/prd/204242162?clr=ecru&colourWayId=204242172&cid=3602
New Look palm revere collar shirt in light green,https://www.asos.com/new-look/new-look-palm-revere-collar-shirt-in-light-green/prd/204739641?clr=light-green&colourWayId=204739642&cid=3602
Topman formal long sleeve shirt in white,https://www.asos.com/topman/topman-formal-long-sleeve-shirt-in-white/prd/201500375?clr=white&colourWayId=201500378&cid=3602
New Look revere collar linen blend shirt in light blue,https://www.asos.com/new-look/new-look-revere-collar-linen-blend-shirt-in-light-blue/prd/204811047?clr=light-blue&colourWayId=204811048&cid=3602
ASOS DESIGN relaxed satin shirt in silver with deep revere,https://www.asos.com/asos-design/asos-design-relaxed-satin-shirt-in-silver-with-deep-revere/prd/202820948?clr=silver&colourWayId=202820950&cid=3602
ASOS DESIGN 90s oversized check shirt in beige,https://www.asos.com/asos-design/asos-design-90s-oversized-check-shirt-in-beige/prd/203488674?clr=beige&colourWayId=203488676&cid=3602
ASOS DESIGN relaxed revere collar shirt in chunky stretch rib in dusty pink,https://www.asos.com/asos-design/asos-design-relaxed-revere-collar-shirt-in-chunky-stretch-rib-in-dusty-pink/prd/204608955?clr=dusty-pink&colourWayId=204608965&cid=3602
ASOS DESIGN bowling shirt in sheer black stripe,https://www.asos.com/asos-design/asos-design-bowling-shirt-in-sheer-black-stripe/prd/204561556?clr=black&colourWayId=204561557&cid=3602
Only & Sons buffalo check shirt in grey and black,https://www.asos.com/only-sons/only-sons-buffalo-check-shirt-in-grey-and-black/prd/203499364?clr=griffin&colourWayId=203499373&cid=3602
Pull&Bear seersucker textured shirt in black,https://www.asos.com/pullbear/pullbear-seersucker-textured-shirt-in-black/prd/204299508?clr=black&colourWayId=204299509&cid=3602
Jack & Jones Premium super slim fit stretch smart shirt in white,https://www.asos.com/jack-jones/jack-jones-premium-super-slim-fit-stretch-smart-shirt-in-white/prd/202676510?clr=white&colourWayId=202676511&cid=3602
ASOS DESIGN formal royal oxford skinny shirt with double cuff in white,https://www.asos.com/asos-design/asos-design-formal-royal-oxford-skinny-shirt-with-double-cuff-in-white/prd/202068261?clr=white&colourWayId=202068263&cid=3602
ASOS DESIGN wedding smart linen regular fit shirt with penny collar in white,https://www.asos.com/asos-design/asos-design-wedding-smart-linen-regular-fit-shirt-with-penny-collar-in-white/prd/203632590?clr=white&colourWayId=203632600&cid=3602
Only & Sons flannel overshirt in khaki,https://www.asos.com/only-sons/only-sons-flannel-overshirt-in-khaki/prd/203322401?clr=winter-moss&colourWayId=203322406&cid=3602
Jack & Jones Premium super slim fit stretch smart shirt in black,https://www.asos.com/jack-jones/jack-jones-premium-super-slim-fit-stretch-smart-shirt-in-black/prd/202681134?clr=black&colourWayId=202681135&cid=3602
Polo Ralph Lauren oxford shirt in slim fit blue,https://www.asos.com/polo-ralph-lauren/polo-ralph-lauren-oxford-shirt-in-slim-fit-blue/prd/202566052?clr=blue&colourWayId=202566053&cid=3602
New Look long sleeve poplin shirt in blue,https://www.asos.com/new-look/new-look-long-sleeve-poplin-shirt-in-blue/prd/204593573?clr=blue&colourWayId=204593582&cid=3602
ASOS DESIGN shacket in cream cord with double pockets,https://www.asos.com/asos-design/asos-design-shacket-in-cream-cord-with-double-pockets/prd/202266444?clr=stone&colourWayId=202266445&cid=3602
ASOS DESIGN 90s oversized cord shirt in beige,https://www.asos.com/asos-design/asos-design-90s-oversized-cord-shirt-in-beige/prd/23558908?clr=beige&colourWayId=60493647&cid=3602
ASOS DESIGN skinny fit shirt with grandad collar in navy,https://www.asos.com/asos-design/asos-design-skinny-fit-shirt-with-grandad-collar-in-navy/prd/201100134?clr=navy&colourWayId=201100143&cid=3602
Topman knitted button through shirt with floral patches in stone,https://www.asos.com/topman/topman-knitted-button-through-shirt-with-floral-patches-in-stone/prd/204195164?clr=stone&colourWayId=204195165&cid=3602
ASOS DESIGN regular satin shirt with ruffle front detail in green stripe,https://www.asos.com/asos-design/asos-design-regular-satin-shirt-with-ruffle-front-detail-in-green-stripe/prd/202957228?clr=green&colourWayId=202957238&cid=3602
COLLUSION Unisex photographic print shirt in multi,https://www.asos.com/collusion/collusion-unisex-photographic-print-shirt-in-multi/prd/201694119?clr=multi&colourWayId=201694120&cid=3602
GANT icon logo slim fit broadcloth oxford shirt in white,https://www.asos.com/gant/gant-icon-logo-slim-fit-broadcloth-oxford-shirt-in-white/prd/202070189?clr=white&colourWayId=202070192&cid=3602
New Look short sleeve stripe linen shirt in white,https://www.asos.com/new-look/new-look-short-sleeve-stripe-linen-shirt-in-white/prd/204880874?clr=white&colourWayId=204880876&cid=3602
ASOS DESIGN overshirt in wool mix buffalo check,https://www.asos.com/asos-design/asos-design-overshirt-in-wool-mix-buffalo-check/prd/203536265?clr=beige&colourWayId=203536266&cid=3602
ASOS DESIGN boxy oversized shirt in chunky cord,https://www.asos.com/asos-design/asos-design-boxy-oversized-shirt-in-chunky-cord/prd/202744022?clr=ecru&colourWayId=202744083&cid=3602
ASOS DESIGN stretch slim denim shirt in black,https://www.asos.com/asos-design/asos-design-stretch-slim-denim-shirt-in-black/prd/200399324?clr=black&colourWayId=200399333&cid=3602
Pull&Bear revere collar textured stripe shirt in beige,https://www.asos.com/pullbear/pullbear-revere-collar-textured-stripe-shirt-in-beige/prd/204840476?clr=beige&colourWayId=204840478&cid=3602
Pull&Bear waffle textured shirt in white,https://www.asos.com/pullbear/pullbear-waffle-textured-shirt-in-white/prd/204299210?clr=white&colourWayId=204299230&cid=3602
ASOS DESIGN regular fit linen shirt with revere collar in ecru,https://www.asos.com/asos-design/asos-design-regular-fit-linen-shirt-with-revere-collar-in-ecru/prd/202368807?clr=ecru&colourWayId=202368809&cid=3602
New Look short sleeve muscle fit jersey shirt in white,https://www.asos.com/new-look/new-look-short-sleeve-muscle-fit-jersey-shirt-in-white/prd/203324913?clr=white&colourWayId=203324917&cid=3602
Only & Sons buffalo check shirt in khaki and black,https://www.asos.com/only-sons/only-sons-buffalo-check-shirt-in-khaki-and-black/prd/203503610?clr=forest-night&colourWayId=203503611&cid=3602
ASOS DESIGN regular smart linen shirt with mandarin collar in white,https://www.asos.com/asos-design/asos-design-regular-smart-linen-shirt-with-mandarin-collar-in-white/prd/201173507?clr=white&colourWayId=201173508&cid=3602
Topman cord shirt in chocolate brown,https://www.asos.com/topman/topman-cord-shirt-in-chocolate-brown/prd/203378249?clr=brown&colourWayId=203378258&cid=3602
ASOS DESIGN stretch skinny fit shirt in white with grandad collar,https://www.asos.com/asos-design/asos-design-stretch-skinny-fit-shirt-in-white-with-grandad-collar/prd/8601497?clr=white&colourWayId=15201231&cid=3602
ASOS DESIGN Premium slim fit sateen shirt with shawl collar in white,https://www.asos.com/asos-design/asos-design-premium-slim-fit-sateen-shirt-with-shawl-collar-in-white/prd/13754602?clr=white&colourWayId=16563348&cid=3602
ASOS DESIGN brushed oxford shirt in cotton blend in taupe,https://www.asos.com/asos-design/asos-design-brushed-oxford-shirt-in-cotton-blend-in-taupe/prd/202662455?clr=taupe&colourWayId=202662457&cid=3602
River Island big & tall long sleeve crepe linen shirt in white,https://www.asos.com/river-island-plus/river-island-big-tall-long-sleeve-crepe-linen-shirt-in-white/prd/204873627?clr=white&colourWayId=204873640&cid=3602
ASOS DESIGN regular linen shirt with low deep revere in stone,https://www.asos.com/asos-design/asos-design-regular-linen-shirt-with-low-deep-revere-in-stone/prd/201595026?clr=beige&colourWayId=201595029&cid=3602
Polo Ralph Lauren icon logo estate collar jersey sport shirt in white,https://www.asos.com/polo-ralph-lauren/polo-ralph-lauren-icon-logo-estate-collar-jersey-sport-shirt-in-white/prd/202060966?clr=white&colourWayId=202060967&cid=3602
ASOS DESIGN boxy oversixed utility shirt with pockets,https://www.asos.com/asos-design/asos-design-boxy-oversixed-utility-shirt-with-pockets/prd/203292215?clr=stone&colourWayId=203292216&cid=3602
River Island short sleeve stripe weave shirt in navy,https://www.asos.com/river-island/river-island-short-sleeve-stripe-weave-shirt-in-navy/prd/204814409?clr=navy&colourWayId=204814418&cid=3602
