description,url
Topman floral print shirt in ecru,https://www.asos.com/topman/topman-floral-print-shirt-in-ecru/prd/203875865?clr=ecru&colourWayId=203875867&cid=3602
Only & Sons oversized shirt in navy stripe,https://www.asos.com/only-sons/only-sons-oversized-shirt-in-navy-stripe/prd/203998036?clr=dark-navy&colourWayId=203998049&cid=3602
New Look check shirt in blue,https://www.asos.com/new-look/new-look-check-shirt-in-blue/prd/204035723?clr=blue-pattern&colourWayId=204035724&cid=3602
New Look animal jacquard satin shirt in black,https://www.asos.com/new-look/new-look-animal-jacquard-satin-shirt-in-black/prd/204087531?clr=black&colourWayId=204087549&cid=3602
Tommy Jeans short sleeve linen shirt in multi stripe,https://www.asos.com/tommy-jeans/tommy-jeans-short-sleeve-linen-shirt-in-multi-stripe/prd/204292234?clr=skysail-multi-stripe&colourWayId=204292308&cid=3602
ASOS DESIGN oversized revere longline bowling shirt in bright floral print,https://www.asos.com/asos-design/asos-design-oversized-revere-longline-bowling-shirt-in-bright-floral-print/prd/204334336?clr=multi&colourWayId=204334339&cid=3602
River Island paisley co-ord shirt in black,https://www.asos.com/river-island/river-island-paisley-co-ord-shirt-in-black/prd/204407515?clr=black&colourWayId=204407516&cid=3602
New Look textured check revere shirt in stone,https://www.asos.com/new-look/new-look-textured-check-revere-shirt-in-stone/prd/204765415?clr=stone&colourWayId=204765416&cid=3602
COLLUSION vintage pocket detail short sleeve shirt in red,https://www.asos.com/collusion/collusion-vintage-pocket-detail-short-sleeve-shirt-in-red/prd/204413218?clr=red&colourWayId=204413220&cid=3602
ASOS DESIGN kimono in neutral stripe,https://www.asos.com/asos-design/asos-design-kimono-in-neutral-stripe/prd/204602799?clr=beige&colourWayId=204602816&cid=3602
ASOS DESIGN kurta longline linen asymmetric shirt in blue abstract floral print,https://www.asos.com/asos-design/asos-design-kurta-longline-linen-asymmetric-shirt-in-blue-abstract-floral-print/prd/204513794?clr=light-blue&colourWayId=204513795&cid=3602
Topman knitted button through shirt with all over print in brown,https://www.asos.com/topman/topman-knitted-button-through-shirt-with-all-over-print-in-brown/prd/204354249?clr=multi&colourWayId=204354250&cid=3602
ASOS DESIGN shirt in black and white buffalo check,https://www.asos.com/asos-design/asos-design-shirt-in-black-and-white-buffalo-check/prd/200311303?clr=black&colourWayId=200311304&cid=3602
ASOS DESIGN stretch skinny shirt in blue check,https://www.asos.com/asos-design/asos-design-stretch-skinny-shirt-in-blue-check/prd/201776702?clr=blue&colourWayId=201776722&cid=3602
ASOS DESIGN skinny viscose shirt in rust,https://www.asos.com/asos-design/asos-design-skinny-viscose-shirt-in-rust/prd/202440663?clr=rust&colourWayId=202440675&cid=3602
ASOS DESIGN super skinny mesh shirt in bright orange,https://www.asos.com/asos-design/asos-design-super-skinny-mesh-shirt-in-bright-orange/prd/202576303?clr=orange&colourWayId=202576317&cid=3602
Levi's Jackson worker shirt in tan check with pockets,https://www.asos.com/levis/levis-jackson-worker-shirt-in-tan-check-with-pockets/prd/202981872?clr=camel&colourWayId=202981873&cid=3602
ASOS DESIGN boxy oversized shirt in aqua,https://www.asos.com/asos-design/asos-design-boxy-oversized-shirt-in-aqua/prd/203125141?clr=bright-green&colourWayId=203125143&cid=3602
Topman satin revere shirt in mono bandana print,https://www.asos.com/topman/topman-satin-revere-shirt-in-mono-bandana-print/prd/203235127?clr=black-and-white&colourWayId=203235136&cid=3602
ASOS DESIGN skinny fit shirt in black,https://www.asos.com/asos-design/asos-design-skinny-fit-shirt-in-black/prd/203276332?clr=black&colourWayId=203276410&cid=3602
ADPT oversized tiger print revere collar shirt in black,https://www.asos.com/adpt/adpt-oversized-tiger-print-revere-collar-shirt-in-black/prd/203834799?clr=black-zebra&colourWayId=203834808&cid=3602
ASOS DESIGN 90s oversized shirt in beige check with Los Angeles back embroidery,https://www.asos.com/asos-design/asos-design-90s-oversized-shirt-in-beige-check-with-los-angeles-back-embroidery/prd/203944416?clr=beige&colourWayId=203944421&cid=3602
Tommy Jeans flag logo sherpa lined overshirt in navy,https://www.asos.com/tommy-jeans/tommy-jeans-flag-logo-sherpa-lined-overshirt-in-navy/prd/204038530?clr=twilight-navy&colourWayId=204038622&cid=3602
New Look piped geo print shirt in white pattern,https://www.asos.com/new-look/new-look-piped-geo-print-shirt-in-white-pattern/prd/204055153?clr=white-pattern&colourWayId=204055155&cid=3602
Barbour Oxtown tailored shirt in blue stripe,https://www.asos.com/barbour/barbour-oxtown-tailored-shirt-in-blue-stripe/prd/204151147?clr=sky-blue&colourWayId=204151171&cid=3602
ASOS DESIGN 90s oversized oxford shirt in lilac yarn dye,https://www.asos.com/asos-design/asos-design-90s-oversized-oxford-shirt-in-lilac-yarn-dye/prd/204205805?clr=lilac&colourWayId=204205815&cid=3602
Topman floral lace short sleeve shirt in black,https://www.asos.com/topman/topman-floral-lace-short-sleeve-shirt-in-black/prd/204308841?clr=black&colourWayId=204308842&cid=3602
Levi's Sunset 1 pocket shirt in green garment dye with logo,https://www.asos.com/levis/levis-sunset-1-pocket-shirt-in-green-garment-dye-with-logo/prd/204417310?clr=green-garment-dye&colourWayId=204417318&cid=3602
Bershka premium pocket shirt in blue,https://www.asos.com/bershka/bershka-premium-pocket-shirt-in-blue/prd/204762440?clr=blue&colourWayId=204762443&cid=3602
Topman short sleeve textured shirt in burgundy,https://www.asos.com/topman/topman-short-sleeve-textured-shirt-in-burgundy/prd/204637068?clr=burgundy&colourWayId=204637069&cid=3602
ASOS DESIGN 90s oversized floral burn out shirt in orange,https://www.asos.com/asos-design/asos-design-90s-oversized-floral-burn-out-shirt-in-orange/prd/204765362?clr=orange&colourWayId=204765363&cid=3602
ASOS DESIGN boxy oversized revere shirt in light green,https://www.asos.com/asos-design/asos-design-boxy-oversized-revere-shirt-in-light-green/prd/204332274?clr=apple-green&colourWayId=204332275&cid=3602
ASOS DESIGN satin shirt with blouson sleeve and grandad neck in blue,https://www.asos.com/asos-design/asos-design-satin-shirt-with-blouson-sleeve-and-grandad-neck-in-blue/prd/204633965?clr=dusky-blue&colourWayId=204633974&cid=3602
Topman oversized overshirt in sage and ecru,https://www.asos.com/topman/topman-oversized-overshirt-in-sage-and-ecru/prd/202279200?clr=sage-and-ecru&colourWayId=202279203&cid=3602
ASOS DESIGN oversized satin shirt in black,https://www.asos.com/asos-design/asos-design-oversized-satin-shirt-in-black/prd/202576376?clr=black&colourWayId=202576391&cid=3602
ASOS DESIGN boxy oversized shirt in multi colour patchwork check,https://www.asos.com/asos-design/asos-design-boxy-oversized-shirt-in-multi-colour-patchwork-check/prd/202667977?clr=multi&colourWayId=202667979&cid=3602
ASOS DESIGN shirt in black and navy stripe,https://www.asos.com/asos-design/asos-design-shirt-in-black-and-navy-stripe/prd/202695349?clr=black&colourWayId=202695369&cid=3602
ASOS DESIGN sheer stripe shirt with tie neck and blouson sleeve in aubergine,https://www.asos.com/asos-design/asos-design-sheer-stripe-shirt-with-tie-neck-and-blouson-sleeve-in-aubergine/prd/203194388?clr=purple&colourWayId=203194392&cid=3602
ASOS DESIGN skinny satin shirt in sand,https://www.asos.com/asos-design/asos-design-skinny-satin-shirt-in-sand/prd/203309791?clr=sand&colourWayId=203309792&cid=3602
ASOS DESIGN relaxed shirt in blue floral print,https://www.asos.com/asos-design/asos-design-relaxed-shirt-in-blue-floral-print/prd/203747053?clr=black&colourWayId=203747069&cid=3602
ASOS DESIGN boxy oversized denim shirt in bright orange,https://www.asos.com/asos-design/asos-design-boxy-oversized-denim-shirt-in-bright-orange/prd/203789325?clr=bright-orange&colourWayId=203789326&cid=3602
ASOS DESIGN boxy chunky cord oversized shirt in light blue,https://www.asos.com/asos-design/asos-design-boxy-chunky-cord-oversized-shirt-in-light-blue/prd/203917474?clr=light-blue&colourWayId=203917475&cid=3602
River Island long sleeve plisse shirt in black,https://www.asos.com/river-island/river-island-long-sleeve-plisse-shirt-in-black/prd/204037582?clr=black&colourWayId=204037592&cid=3602
COLLUSION skater short sleeve shirt co-ord in stone check,https://www.asos.com/collusion/collusion-skater-short-sleeve-shirt-co-ord-in-stone-check/prd/204106467?clr=stone&colourWayId=204106468&cid=3602
ASOS DESIGN dropped shoulder oversized sheer shirt in orange tie dye,https://www.asos.com/asos-design/asos-design-dropped-shoulder-oversized-sheer-shirt-in-orange-tie-dye/prd/204191371?clr=orange&colourWayId=204191381&cid=3602
ASOS DESIGN boxy oversized shirt in mushroom print,https://www.asos.com/asos-design/asos-design-boxy-oversized-shirt-in-mushroom-print/prd/204334338?clr=brown&colourWayId=204334341&cid=3602
Levi's Sunset Camp shirt in all over fun art print,https://www.asos.com/levis/levis-sunset-camp-shirt-in-all-over-fun-art-print/prd/204417380?clr=artschool-print&colourWayId=204417381&cid=3602
ASOS DESIGN co-ord boxy oversized shirt in vintage inspired print,https://www.asos.com/asos-design/asos-design-co-ord-boxy-oversized-shirt-in-vintage-inspired-print/prd/204538225?clr=navy&colourWayId=204538227&cid=3602
ASOS DESIGN relaxed revere collar viscose shirt with contrast topstitching in black,https://www.asos.com/asos-design/asos-design-relaxed-revere-collar-viscose-shirt-with-contrast-topstitching-in-black/prd/204608945?clr=black&colourWayId=204608947&cid=3602
Topman viscose revere shirt with sol valley print in tan,https://www.asos.com/topman/topman-shirt-and-short-co-ord-with-sol-valley-print-in-stone/grp/205153660?clr=brown-print&colourWayId=203235189&cid=3602#203235186
ASOS DESIGN kurta longline linen shirt with asymmetric hem in green floral print,https://www.asos.com/asos-design/asos-design-kurta-longline-linen-shirt-with-asymmetric-hem-in-green-floral-print/prd/204513736?clr=sage-green&colourWayId=204513737&cid=3602
COLLUSION boxy revere short sleeve shirt in grey,https://www.asos.com/collusion/collusion-boxy-revere-short-sleeve-shirt-in-grey/prd/203939992?clr=grey&colourWayId=203939994&cid=3602
ASOS DESIGN sleeveless satin tie neck shirt in black,https://www.asos.com/asos-design/asos-design-sleeveless-satin-tie-neck-shirt-in-black/prd/204322719?clr=black&colourWayId=204322720&cid=3602
Topman short sleeve oversized shirt with hood in black,https://www.asos.com/topman/topman-short-sleeve-oversized-shirt-with-hood-in-black/prd/201610867?clr=black&colourWayId=201610870&cid=3602
ASOS DESIGN oversized cord shirt in pink with double pockets,https://www.asos.com/asos-design/asos-design-oversized-cord-shirt-in-pink-with-double-pockets/prd/202501329?clr=dusky-pink&colourWayId=202501338&cid=3602
ASOS DESIGN Premium slim fit sateen shirt with mandarin collar in black,https://www.asos.com/asos-design/asos-design-premium-slim-fit-sateen-shirt-with-mandarin-collar-in-black/prd/202637721?clr=black&colourWayId=202637730&cid=3602
ASOS DESIGN relaxed revere shirt in MTV print,https://www.asos.com/asos-design/asos-design-relaxed-revere-shirt-in-mtv-print/prd/202693450?clr=black&colourWayId=202693451&cid=3602
ASOS DESIGN satin shirt with tie neck and blouson volume sleeve in jewel green,https://www.asos.com/asos-design/asos-design-satin-shirt-with-tie-neck-and-blouson-volume-sleeve-in-jewel-green/prd/202758317?clr=jewel-green&colourWayId=202758330&cid=3602
ASOS DESIGN regular satin shirt in khaki,https://www.asos.com/asos-design/asos-design-regular-satin-shirt-in-khaki/prd/202821108?clr=khaki&colourWayId=202821110&cid=3602
ASOS DESIGN oversized fleece shirt in neutral cut and sew,https://www.asos.com/asos-design/asos-design-oversized-fleece-shirt-in-neutral-cut-and-sew/prd/202821152?clr=multi&colourWayId=202821153&cid=3602
Topman slim smart shirt in black,https://www.asos.com/topman/topman-slim-smart-shirt-in-black/prd/202945266?clr=black&colourWayId=202945267&cid=3602
ASOS DESIGN Premium slim fit sateen shirt with shawl collar in white,https://www.asos.com/asos-design/asos-design-premium-slim-fit-sateen-shirt-with-shawl-collar-in-white/prd/203194385?clr=white&colourWayId=203194389&cid=3602
ASOS DESIGN sheer shirt with lace detail and pussybow neck tie in white,https://www.asos.com/asos-design/asos-design-sheer-shirt-with-lace-detail-and-pussybow-neck-tie-in-white/prd/203438723?clr=white&colourWayId=203438725&cid=3602
ASOS DESIGN relaxed revere shirt in wavey print,https://www.asos.com/asos-design/asos-design-relaxed-revere-shirt-in-wavey-print/prd/203454182?clr=blue&colourWayId=203454240&cid=3602
ASOS DESIGN skinny shirt with grandad collar in herringbone texture,https://www.asos.com/asos-design/asos-design-skinny-shirt-with-grandad-collar-in-herringbone-texture/prd/203574717?clr=black&colourWayId=203574725&cid=3602
Topman woven stripe shirt in washed navy and stone,https://www.asos.com/topman/topman-woven-stripe-shirt-in-washed-navy-and-stone/prd/203596679?clr=navy-and-stone&colourWayId=203596690&cid=3602
ASOS DESIGN 90s oversized shirt in vintage inspired twill stripe,https://www.asos.com/asos-design/asos-design-90s-oversized-shirt-in-vintage-inspired-twill-stripe/prd/203607229?clr=multi&colourWayId=203607230&cid=3602
ASOS DESIGN satin shirt with western cut & sew detail in black,https://www.asos.com/asos-design/asos-design-satin-shirt-with-western-cut-sew-detail-in-black/prd/203942045?clr=black&colourWayId=203942054&cid=3602
Only & Sons heavyweight check overshirt in black,https://www.asos.com/only-sons/only-sons-heavyweight-check-overshirt-in-black/prd/203998340?clr=black&colourWayId=203998369&cid=3602
River Island long sleeve printed leaves party shirt in brown,https://www.asos.com/river-island/river-island-long-sleeve-printed-leaves-party-shirt-in-brown/prd/204036329?clr=brown&colourWayId=204036330&cid=3602
Topman Premium wing collar formal shirt in white,https://www.asos.com/topman/topman-premium-wing-collar-formal-shirt-in-white/prd/204205077?clr=white&colourWayId=204205084&cid=3602
Jack & Jones Essentials linen shirt with grandad collar in black,https://www.asos.com/jack-jones/jack-jones-essentials-linen-shirt-with-grandad-collar-in-black/prd/204245719?clr=black&colourWayId=204245733&cid=3602
Carhartt WIP madison corduroy shirt in white,https://www.asos.com/carhartt-wip/carhartt-wip-madison-corduroy-shirt-in-white/prd/204360500?clr=white&colourWayId=204360542&cid=3602
ASOS DESIGN stretch slim stripe shirt,https://www.asos.com/asos-design/asos-design-stretch-slim-stripe-shirt/prd/202668016?clr=navy&colourWayId=202668041&cid=3602
ASOS DESIGN satin shirt in patchwork print,https://www.asos.com/asos-design/asos-design-satin-shirt-in-patchwork-print/prd/202701035?clr=multi&colourWayId=202701046&cid=3602
ASOS DESIGN relaxed fit tie front shirt in plum,https://www.asos.com/asos-design/asos-design-relaxed-fit-tie-front-shirt-in-plum/prd/202869581?clr=plum&colourWayId=202869590&cid=3602
Topman smart textured short sleeve revere shirt,https://www.asos.com/topman/topman-smart-textured-short-sleeve-revere-shirt/prd/203061104?clr=white&colourWayId=203061105&cid=3602
Topman velour shirt in grey,https://www.asos.com/topman/topman-velour-shirt-in-grey/prd/203192749?clr=grey&colourWayId=203192750&cid=3602
ASOS DESIGN paisley embossed velvet shirt with tie neck in brown,https://www.asos.com/asos-design/asos-design-paisley-embossed-velvet-shirt-with-tie-neck-in-brown/prd/203194269?clr=brown&colourWayId=203194278&cid=3602
Selected Homme 2 pack slim fit poplin shirt in white & black,https://www.asos.com/selected-homme/selected-homme-2-pack-slim-fit-poplin-shirt-in-white-black/prd/203226404?clr=black&colourWayId=203226405&cid=3602
Topman Premium formal shirt in sage green,https://www.asos.com/topman/topman-premium-formal-shirt-in-sage-green/prd/203235159?clr=sage&colourWayId=203235161&cid=3602
Topman crochet revere shirt in multi,https://www.asos.com/topman/topman-crochet-revere-shirt-in-multi/prd/203261493?clr=multi-stripe&colourWayId=203261498&cid=3602
ASOS DESIGN Unisex 90s oversized cord shirt in 70s floral print,https://www.asos.com/asos-design/asos-design-unisex-90s-oversized-cord-shirt-in-70s-floral-print/prd/203263076?clr=brown&colourWayId=203263079&cid=3602
ASOS DESIGN skinny satin shirt in copper,https://www.asos.com/asos-design/asos-design-skinny-satin-shirt-in-copper/prd/203309830?clr=copper&colourWayId=203309842&cid=3602
Dickies Evansville long sleeve shirt in beige,https://www.asos.com/dickies/dickies-evansville-long-sleeve-shirt-in-beige/prd/203369495?clr=beige&colourWayId=203369496&cid=3602
ASOS DESIGN satin shirt with blouson sleeve and pussybow tie neck in brown,https://www.asos.com/asos-design/asos-design-satin-shirt-with-blouson-sleeve-and-pussybow-tie-neck-in-brown/prd/203438789?clr=brown&colourWayId=203438791&cid=3602
Dickies Union shirt in black,https://www.asos.com/dickies/dickies-union-shirt-in-black/prd/203461367?clr=black&colourWayId=203461385&cid=3602
ASOS DESIGN 90s oversized shirt in vintage inspired print,https://www.asos.com/asos-design/asos-design-90s-oversized-shirt-in-vintage-inspired-print/prd/203488647?clr=red&colourWayId=203488675&cid=3602
ASOS DESIGN relaxed revere satin shirt in blur spray print,https://www.asos.com/asos-design/asos-design-relaxed-revere-satin-shirt-in-blur-spray-print/prd/203490550?clr=multi&colourWayId=203490553&cid=3602
ASOS DESIGN boxy oversized revere linen mix check shirt in orange,https://www.asos.com/asos-design/asos-design-boxy-oversized-revere-linen-mix-check-shirt-in-orange/prd/203655399?clr=orange&colourWayId=203655400&cid=3602
ASOS DESIGN relaxed revere retro stripe shirt in burgundy,https://www.asos.com/asos-design/asos-design-relaxed-revere-retro-stripe-shirt-in-burgundy/prd/203755665?clr=burgundy&colourWayId=203755666&cid=3602
New Look muscle fit oxford shirt in tan,https://www.asos.com/new-look/new-look-muscle-fit-oxford-shirt-in-tan/prd/203830335?clr=tan&colourWayId=203830336&cid=3602
River Island long sleeve camo printed shirt in green,https://www.asos.com/river-island/river-island-long-sleeve-camo-printed-shirt-in-green/prd/203994984?clr=green-dark&colourWayId=203995016&cid=3602
Barbour Nelson tailored shirt in blue,https://www.asos.com/barbour/barbour-nelson-tailored-shirt-in-blue/prd/204151104?clr=blue&colourWayId=204151125&cid=3602
ASOS DESIGN relaxed revere bowling shirt in green with chest embroidery,https://www.asos.com/asos-design/asos-design-relaxed-revere-bowling-shirt-in-green-with-chest-embroidery/prd/204191299?clr=green&colourWayId=204191317&cid=3602
Topman grid lace short sleeve shirt in ecru,https://www.asos.com/topman/topman-grid-lace-short-sleeve-shirt-in-ecru/prd/204306642?clr=ecru&colourWayId=204306643&cid=3602
ASOS DESIGN relaxed revere shirt in organza with orchid floral embroidery,https://www.asos.com/asos-design/asos-design-relaxed-revere-shirt-in-organza-with-orchid-floral-embroidery/prd/204334430?clr=black&colourWayId=204334438&cid=3602
Topman long sleeve stretch shirt in black,https://www.asos.com/topman/topman-long-sleeve-stretch-shirt-in-black/prd/204354451?clr=black&colourWayId=204354453&cid=3602
Levi's Sunset 1 pocket shirt in blue stripe with logo,https://www.asos.com/levis/levis-sunset-1-pocket-shirt-in-blue-stripe-with-logo/prd/204417280?clr=green-blue-slate&colourWayId=204417287&cid=3602
Levi's revere collar shirt in blue all over print,https://www.asos.com/levis/levis-revere-collar-shirt-in-blue-all-over-print/prd/204417393?clr=moonlight-blue&colourWayId=204417399&cid=3602
Lyle & Scott oversized oxford shirt in blue,https://www.asos.com/lyle-scott/lyle-scott-oversized-oxford-shirt-in-blue/prd/204543332?clr=blue&colourWayId=204543333&cid=3602
Polo Ralph Lauren icon logo slim fit cotton stretch poplin shirt in tan,https://www.asos.com/polo-ralph-lauren/polo-ralph-lauren-icon-logo-slim-fit-cotton-stretch-poplin-shirt-in-tan/prd/204556308?clr=tan&colourWayId=204556325&cid=3602
Polo Ralph Lauren icon logo cotton terry revere collar short sleeve shirt in white,https://www.asos.com/polo-ralph-lauren/polo-ralph-lauren-icon-logo-cotton-terry-revere-collar-short-sleeve-shirt-in-white/prd/204556543?clr=white&colourWayId=204556558&cid=3602
Topman striped shirt in yellow and navy,https://www.asos.com/topman/topman-striped-shirt-in-yellow-and-navy/prd/204779187?clr=multi&colourWayId=204779188&cid=3602
ASOS DESIGN formal sateen skinny fit shirt with wing collar in black,https://www.asos.com/asos-design/asos-design-formal-sateen-skinny-fit-shirt-with-wing-collar-in-black/prd/200789307?clr=black&colourWayId=200789318&cid=3602
Topman 90's oversized flannel check shirt in multi,https://www.asos.com/topman/topman-90s-oversized-flannel-check-shirt-in-multi/prd/200852401?clr=multi&colourWayId=200852415&cid=3602
Topman quilted overshirt in blue,https://www.asos.com/topman/topman-quilted-overshirt-in-blue/prd/202585001?clr=blue&colourWayId=202585026&cid=3602
ASOS DESIGN skinny stripe shirt with grandad collar in light blue,https://www.asos.com/asos-design/asos-design-skinny-stripe-shirt-with-grandad-collar-in-light-blue/prd/202637527?clr=light-blue&colourWayId=202637542&cid=3602
Topman chore jacket with all over animal print in charcoal,https://www.asos.com/topman/topman-chore-jacket-with-all-over-animal-print-in-charcoal/prd/202687982?clr=grey&colourWayId=202687983&cid=3602
ASOS DESIGN slim oxford shirt in washed red,https://www.asos.com/asos-design/asos-design-slim-oxford-shirt-in-washed-red/prd/202737343?clr=washed-red&colourWayId=202737353&cid=3602
ASOS DESIGN cropped satin shirt with hook & eye fastening in brown,https://www.asos.com/asos-design/asos-design-cropped-satin-shirt-with-hook-eye-fastening-in-brown/prd/202758398?clr=brown&colourWayId=202758403&cid=3602
ASOS DESIGN overshirt in wool mix dogtooth check,https://www.asos.com/asos-design/asos-design-overshirt-in-wool-mix-dogtooth-check/prd/202877126?clr=black&colourWayId=202877131&cid=3602
Selected Homme long sleeve sateen shirt in white,https://www.asos.com/selected-homme/selected-homme-long-sleeve-sateen-shirt-in-white/prd/202941204?clr=bright-white&colourWayId=202941206&cid=3602
ASOS DESIGN relaxed satin shirt with flute sleeve in black,https://www.asos.com/asos-design/asos-design-relaxed-satin-shirt-with-flute-sleeve-in-black/prd/202956997?clr=black&colourWayId=202957009&cid=3602
ASOS DESIGN relaxed revere satin shirt with placement print,https://www.asos.com/asos-design/asos-design-relaxed-revere-satin-shirt-with-placement-print/prd/203064246?clr=blue&colourWayId=203064266&cid=3602
ASOS DESIGN dropped shoulder oversized revere shirt in diagonal zig zag stripe,https://www.asos.com/asos-design/asos-design-dropped-shoulder-oversized-revere-shirt-in-diagonal-zig-zag-stripe/prd/203095707?clr=red&colourWayId=203095708&cid=3602
ASOS DESIGN 90s oversized flannel shirt in stone stripe,https://www.asos.com/asos-design/asos-design-90s-oversized-flannel-shirt-in-stone-stripe/prd/203207609?clr=stone&colourWayId=203207610&cid=3602
ASOS DESIGN relaxed revere shirt in blue argyle check,https://www.asos.com/asos-design/asos-design-relaxed-revere-shirt-in-blue-argyle-check/prd/203259341?clr=blue&colourWayId=203259342&cid=3602
Devils Advocate long sleeve feather print shirt in navy,https://www.asos.com/devils-advocate/devils-advocate-long-sleeve-feather-print-shirt-in-navy/prd/203261096?clr=navy&colourWayId=203261098&cid=3602
ASOS DESIGN stretch slim fit check shirt in navy,https://www.asos.com/asos-design/asos-design-stretch-slim-fit-check-shirt-in-navy/prd/203350067?clr=navy&colourWayId=203350069&cid=3602
Noak easy iron regular formal shirt with wing collar in textured oxford fabric,https://www.asos.com/asos-design/noak-easy-iron-regular-formal-shirt-with-wing-collar-in-textured-oxford-fabric/prd/203438868?clr=black&colourWayId=203438869&cid=3602
Dickies Sacramento shirt in red,https://www.asos.com/dickies/dickies-sacramento-shirt-in-red/prd/203461506?clr=red&colourWayId=203461526&cid=3602
Jack & Jones Essentials brushed check overshirt in light brown,https://www.asos.com/jack-jones/jack-jones-essentials-brushed-check-overshirt-in-light-brown/prd/203588907?clr=sepia-tint&colourWayId=203588950&cid=3602
ASOS DESIGN wedding premium skinny sateen shirt in light blue,https://www.asos.com/asos-design/asos-design-wedding-premium-skinny-sateen-shirt-in-light-blue/prd/203632539?clr=light-blue&colourWayId=203632540&cid=3602
Topman formal textured shirt with snap double cuff in black,https://www.asos.com/topman/topman-formal-textured-shirt-with-snap-double-cuff-in-black/prd/203702836?clr=black&colourWayId=203702838&cid=3602
Selected Homme slub shirt in beige,https://www.asos.com/selected-homme/selected-homme-slub-shirt-in-beige/prd/203730758?clr=oatmeal&colourWayId=203730781&cid=3602
ASOS DESIGN relaxed shirt in zebra satin jacquard print in black,https://www.asos.com/asos-design/asos-design-relaxed-shirt-in-zebra-satin-jacquard-print-in-black/prd/203790014?clr=black&colourWayId=203790017&cid=3602
COLLUSION drop shoulder oversized shirt in white,https://www.asos.com/collusion/collusion-drop-shoulder-oversized-shirt-in-white/prd/203940027?clr=white&colourWayId=203940028&cid=3602
ASOS DESIGN slim oxford shirt with grandad collar in light beige yarn dye,https://www.asos.com/asos-design/asos-design-slim-oxford-shirt-with-grandad-collar-in-light-beige-yarn-dye/prd/203942071?clr=light-beige&colourWayId=203942082&cid=3602
ASOS DESIGN boxy oversized linen mix shirt in grey stripe,https://www.asos.com/asos-design/asos-design-boxy-oversized-linen-mix-shirt-in-grey-stripe/prd/204059797?clr=grey&colourWayId=204059804&cid=3602
Reclaimed Vintage unisex beach revere shirt in 90s celestial print,https://www.asos.com/reclaimed-vintage/reclaimed-vintage-unisex-beach-revere-shirt-in-90s-celestial-print/prd/204064483?clr=multi&colourWayId=204064484&cid=3602
