description,url
Hunky Trunks beach shirt in khaki checkerboard print,https://www.asos.com/hunky-trunks/hunky-trunks-beach-shirt-in-khaki-checkerboard-print/prd/203860303?clr=khaki&colourWayId=203860309&cid=3602
ASOS DESIGN shacket in dark brown,https://www.asos.com/asos-design/asos-design-shacket-in-dark-brown/prd/204521258?clr=brown&colourWayId=204521260&cid=3602
ASOS DESIGN boxy oversized linen mix shirt in floral blanket print,https://www.asos.com/asos-design/asos-design-boxy-oversized-linen-mix-shirt-in-floral-blanket-print/prd/204562382?clr=multi&colourWayId=204562394&cid=3602
Barbour Edderton tailored shirt in classic tartan,https://www.asos.com/barbour/barbour-edderton-tailored-shirt-in-classic-tartan/prd/204592839?clr=classic-tartan&colourWayId=204592840&cid=3602
New Look long sleeve muscle fit poplin shirt in black,https://www.asos.com/new-look/new-look-long-sleeve-muscle-fit-poplin-shirt-in-black/prd/203477647?clr=black&colourWayId=203477712&cid=3602
New Look long sleeve muscle fit oxford shirt in white,https://www.asos.com/new-look/new-look-long-sleeve-muscle-fit-oxford-shirt-in-white/prd/203508932?clr=white&colourWayId=203508933&cid=3602
New Look short sleeve poplin shirt in white,https://www.asos.com/new-look/new-look-short-sleeve-poplin-shirt-in-white/prd/204664149?clr=white&colourWayId=204664152&cid=3602
New Look long sleeve grandad poplin shirt in black,https://www.asos.com/new-look/new-look-long-sleeve-grandad-poplin-shirt-in-black/prd/201351725?clr=black&colourWayId=201351727&cid=3602
Reclaimed Vintage inspired unisex shacket in aztec print in cream,https://www.asos.com/reclaimed-vintage/reclaimed-vintage-inspired-unisex-shacket-in-aztec-print-in-cream/prd/203026418?clr=multi&colourWayId=203026419&cid=3602
ASOS DESIGN wool mix oversized shacket in navy stripe,https://www.asos.com/asos-design/asos-design-wool-mix-oversized-shacket-in-navy-stripe/prd/200513422?clr=yellow&colourWayId=200513423&cid=3602
ASOS DESIGN oversized borg shacket in teal,https://www.asos.com/asos-design/asos-design-oversized-borg-shacket-in-teal/prd/201185908?clr=green&colourWayId=201185909&cid=3602
Reclaimed Vintage aztec print shacket in brown,https://www.asos.com/reclaimed-vintage/reclaimed-vintage-aztec-print-shacket-in-brown/prd/203026390?clr=multi&colourWayId=203026391&cid=3602
Jack & Jones oversized revere collar shirt with palm back print in white,https://www.asos.com/jack-jones/jack-jones-oversized-revere-collar-shirt-with-palm-back-print-in-white/prd/204610330?clr=cloud-dancer&colourWayId=204610380&cid=3602
ASOS DESIGN relaxed shirt in large Hawaiian print,https://www.asos.com/asos-design/asos-design-relaxed-shirt-in-large-hawaiian-print/prd/204631581?clr=beige&colourWayId=204631593&cid=3602
Bershka palm tropical printed shirt in olive green,https://www.asos.com/bershka/bershka-palm-tropical-printed-shirt-in-olive-green/prd/205011623?clr=olive-green&colourWayId=205011631&cid=3602
ASOS DESIGN relaxed sheer shirt in hot pink,https://www.asos.com/asos-design/asos-design-relaxed-sheer-shirt-in-hot-pink/prd/202018653?clr=hot-pink&colourWayId=202018661&cid=3602
ASOS DESIGN cotton shacket in light grey,https://www.asos.com/asos-design/asos-design-cotton-shacket-in-light-grey/prd/202821091?clr=light-grey&colourWayId=202821093&cid=3602
ASOS DESIGN Premium slim fit sateen shirt in white,https://www.asos.com/asos-design/asos-design-premium-slim-fit-sateen-shirt-in-white/prd/203194259?clr=white&colourWayId=203194268&cid=3602
ASOS DESIGN boxy oversized viscose shirt in brown,https://www.asos.com/asos-design/asos-design-boxy-oversized-viscose-shirt-in-brown/prd/203724087?clr=brown&colourWayId=203724091&cid=3602
ASOS DESIGN relaxed viscose shirt in sage green,https://www.asos.com/asos-design/asos-design-relaxed-viscose-shirt-in-sage-green/prd/203789193?clr=sage-green&colourWayId=203789197&cid=3602
Selected Homme cotton mix seersucker shirt in beige stripe,https://www.asos.com/selected-homme/selected-homme-cotton-mix-seersucker-shirt-in-beige-stripe/prd/204173581?clr=cloud-dancer&colourWayId=204173629&cid=3602
Jack & Jones Essentials short sleeve revere collar viscose floral shirt in black,https://www.asos.com/jack-jones/jack-jones-essentials-short-sleeve-revere-collar-viscose-floral-shirt-in-black/prd/204246037?clr=black&colourWayId=204246083&cid=3602
Jack & Jones Essentials short sleeve linen shirt in beige,https://www.asos.com/jack-jones/jack-jones-essentials-short-sleeve-linen-shirt-in-beige/prd/204246132?clr=crockery&colourWayId=204246157&cid=3602
Topman short sleeve tie dye shirt in blue,https://www.asos.com/topman/topman-short-sleeve-tie-dye-shirt-in-blue/prd/204542797?clr=blue&colourWayId=204542805&cid=3602
Tommy Hilfiger slim fit long sleeve linen shirt in blue,https://www.asos.com/tommy-hilfiger/tommy-hilfiger-slim-fit-long-sleeve-linen-shirt-in-blue/prd/204783805?clr=blue&colourWayId=204783812&cid=3602
Polo Ralph Lauren icon logo short sleeve poplin shirt slim fit in black,https://www.asos.com/polo-ralph-lauren/polo-ralph-lauren-icon-logo-short-sleeve-poplin-shirt-slim-fit-in-black/prd/202851199?clr=black&colourWayId=202851200&cid=3602
Farah Brewer long sleeve shirt in pink,https://www.asos.com/farah/farah-brewer-long-sleeve-shirt-in-pink/prd/202969822?clr=pink&colourWayId=202969832&cid=3602
Polo Ralph Lauren x ASOS exclusive collab terry towelling revere collar shirt in cream with back print logo,https://www.asos.com/polo-ralph-lauren/polo-ralph-lauren-x-asos-exclusive-collab-terry-towelling-revere-collar-shirt-in-cream-with-back-print-logo/prd/204791630?clr=cream&colourWayId=204791644&cid=3602
ASOS DESIGN 2 pack stretch slim fit work shirt in white / blue save,https://www.asos.com/asos-design/asos-design-2-pack-stretch-slim-fit-work-shirt-in-white-blue-save/prd/204003362?clr=white-blue&colourWayId=204003363&cid=3602
Jack & Jones Essentials short sleeve revere collar viscose shirt in black,https://www.asos.com/jack-jones/jack-jones-essentials-short-sleeve-revere-collar-viscose-shirt-in-black/prd/204245558?clr=black&colourWayId=204245625&cid=3602
Jack & Jones Essentials short sleeve linen shirt in white,https://www.asos.com/jack-jones/jack-jones-essentials-short-sleeve-linen-shirt-in-white/prd/204245908?clr=white&colourWayId=204245938&cid=3602
Jack & Jones Essentials short sleeve revere collar viscose shirt in beige,https://www.asos.com/jack-jones/jack-jones-essentials-short-sleeve-revere-collar-viscose-shirt-in-beige/prd/204246150?clr=crockery&colourWayId=204246199&cid=3602
Jack & Jones short sleeve revere shirt in black,https://www.asos.com/jack-jones/jack-jones-short-sleeve-revere-shirt-in-black/prd/204284517?clr=black&colourWayId=204284554&cid=3602
Jack & Jones short sleeve printed revere shirt in white,https://www.asos.com/jack-jones/jack-jones-short-sleeve-printed-revere-shirt-in-white/prd/204284699?clr=white&colourWayId=204284747&cid=3602
Jack & Jones short sleeve shirt in white,https://www.asos.com/jack-jones/jack-jones-short-sleeve-shirt-in-white/prd/204285023?clr=white&colourWayId=204285041&cid=3602
Jack & Jones short sleeve shirt in denim blue,https://www.asos.com/jack-jones/jack-jones-short-sleeve-shirt-in-denim-blue/prd/204285177?clr=blue&colourWayId=204285184&cid=3602
Jack & Jones Originals floral print short sleeve shirt in navy,https://www.asos.com/jack-jones/jack-jones-originals-floral-print-short-sleeve-shirt-in-navy/prd/203943701?clr=navy-blazer&colourWayId=203943718&cid=3602
South Beach linen blend beach shirt in black,https://www.asos.com/south-beach/south-beach-linen-blend-beach-co-ord-in-black/grp/205069666?clr=black&colourWayId=201557325&cid=3602#201557324
ASOS DESIGN stretch slim fit work shirt in white,https://www.asos.com/asos-design/asos-design-stretch-slim-fit-work-shirt-in-white/prd/203384396?clr=white&colourWayId=203384404&cid=3602
ASOS DESIGN stretch slim oxford stripe shirt in sage green,https://www.asos.com/asos-design/asos-design-stretch-slim-oxford-stripe-shirt-in-sage-green/prd/203648209?clr=green&colourWayId=203648210&cid=3602
New Look long sleeve poplin shirt in white,https://www.asos.com/new-look/new-look-long-sleeve-poplin-shirt-in-white/prd/204266591?clr=white&colourWayId=204266595&cid=3602
ASOS DESIGN relaxed viscose shirt in navy,https://www.asos.com/asos-design/asos-design-relaxed-viscose-shirt-in-navy/prd/203869268?clr=navy&colourWayId=203869277&cid=3602
ASOS DESIGN 90s oversized linen shirt in ecru,https://www.asos.com/asos-design/asos-design-90s-oversized-linen-shirt-in-ecru/prd/203387022?clr=ecru&colourWayId=203387023&cid=3602
ASOS DESIGN boxy oversized revere textured stripe shirt in brown,https://www.asos.com/asos-design/asos-design-boxy-oversized-revere-textured-stripe-shirt-in-brown/prd/204328400?clr=brown&colourWayId=204328409&cid=3602
ASOS DESIGN formal skinny fit oxford shirt with double cuff in white,https://www.asos.com/asos-design/asos-design-formal-skinny-fit-oxford-shirt-with-double-cuff-in-white/prd/202662402?clr=white&colourWayId=202662404&cid=3602
Only & Sons linen mix revere collar shirt in beige,https://www.asos.com/only-sons/only-sons-linen-mix-revere-collar-shirt-in-beige/prd/204401859?clr=chinchilla&colourWayId=204401868&cid=3602
New Look short sleeve linen blend revere shirt in white,https://www.asos.com/new-look/new-look-short-sleeve-linen-blend-revere-shirt-in-white/prd/204732346?clr=white&colourWayId=204732347&cid=3602
ASOS DESIGN stretch slim oxford stripe shirt in navy,https://www.asos.com/asos-design/asos-design-stretch-slim-oxford-stripe-shirt-in-navy/prd/203648296?clr=navy&colourWayId=203648297&cid=3602
ASOS DESIGN relaxed textured stripe shirt in white,https://www.asos.com/asos-design/asos-design-relaxed-textured-stripe-shirt-in-white/prd/204137991?clr=white&colourWayId=204137992&cid=3602
ASOS DESIGN revere textured stripe shirt in beige,https://www.asos.com/asos-design/asos-design-revere-textured-stripe-shirt-in-beige/prd/204059510?clr=beige&colourWayId=204059529&cid=3602
New Look abstract print revere collar shirt in black,https://www.asos.com/new-look/new-look-abstract-print-revere-collar-shirt-in-black/prd/204836533?clr=black-pattern&colourWayId=204836537&cid=3602
ASOS DESIGN cotton shacket in stone,https://www.asos.com/asos-design/asos-design-cotton-shacket-in-stone/prd/202820984?clr=stone&colourWayId=202820985&cid=3602
New Look waffle revere shirt co-ord in white - co-ord 3,https://www.asos.com/new-look/new-look-waffle-revere-shirt-co-ord-in-white-co-ord-3/prd/204732331?clr=white&colourWayId=204732332&cid=3602
Topman long sleeve slim formal shirt in white,https://www.asos.com/topman/topman-long-sleeve-slim-formal-shirt-in-white/prd/203046571?clr=white&colourWayId=203046573&cid=3602
ASOS DESIGN skinny fit shirt in navy,https://www.asos.com/asos-design/asos-design-skinny-fit-shirt-in-navy/prd/201173394?clr=navy&colourWayId=201173395&cid=3602
ASOS DESIGN relaxed linen shirt in black,https://www.asos.com/asos-design/asos-design-relaxed-linen-shirt-in-black/prd/204198317?clr=black&colourWayId=204198330&cid=3602
ASOS DESIGN relaxed viscose shirt in stone,https://www.asos.com/asos-design/asos-design-relaxed-viscose-shirt-in-stone/prd/203724124?clr=stone&colourWayId=203724141&cid=3602
ASOS DESIGN knitted stripe shirt in navy,https://www.asos.com/asos-design/asos-design-knitted-stripe-shirt-in-navy/prd/204300681?clr=navy&colourWayId=204300682&cid=3602
Reclaimed Vintage viscose revere shirt in black,https://www.asos.com/reclaimed-vintage/reclaimed-vintage-viscose-revere-shirt-in-black/prd/204035224?clr=black&colourWayId=204035225&cid=3602
ASOS DESIGN regular fit shirt in white,https://www.asos.com/asos-design/asos-design-regular-fit-shirt-in-white/prd/202680860?clr=white&colourWayId=202680887&cid=3602
ASOS DESIGN 90s oversized cord shirt in washed black,https://www.asos.com/asos-design/asos-design-90s-oversized-cord-shirt-in-washed-black/prd/202576166?clr=washed-black&colourWayId=202576186&cid=3602
ASOS DESIGN brushed oxford shirt in neutral,https://www.asos.com/asos-design/asos-design-brushed-oxford-shirt-in-neutral/prd/202575946?clr=beige&colourWayId=202575948&cid=3602
ASOS DESIGN stretch slim fit work shirt in white,https://www.asos.com/asos-design/asos-design-stretch-slim-fit-work-shirt-in-white/prd/202680858?clr=white&colourWayId=202680861&cid=3602
ASOS DESIGN relaxed revere linen mix stripe shirt in beige,https://www.asos.com/asos-design/asos-design-relaxed-revere-linen-mix-stripe-shirt-in-beige/prd/203678546?clr=beige&colourWayId=203678557&cid=3602
ASOS DESIGN regular smart linen shirt with penny collar in ecru,https://www.asos.com/asos-design/asos-design-regular-smart-linen-shirt-with-penny-collar-in-ecru/prd/201614034?clr=ecru&colourWayId=201614035&cid=3602
ASOS DESIGN cotton shacket in navy,https://www.asos.com/asos-design/asos-design-cotton-shacket-in-navy/prd/202821191?clr=navy&colourWayId=202821192&cid=3602
Topman short sleeve stretch skinny smart shirt in white,https://www.asos.com/topman/topman-short-sleeve-stretch-skinny-smart-shirt-in-white/prd/202945274?clr=white&colourWayId=202945278&cid=3602
ASOS DESIGN relaxed deep revere waffle shirt in navy,https://www.asos.com/asos-design/asos-design-relaxed-deep-revere-waffle-shirt-in-navy/prd/204332070?clr=navy&colourWayId=204332072&cid=3602
ASOS DESIGN regular fit smart linen short sleeve shirt in white,https://www.asos.com/asos-design/asos-design-regular-fit-smart-linen-short-sleeve-shirt-in-white/prd/203632572?clr=white&colourWayId=203632574&cid=3602
Bershka rustic monochrome floral shirt in white,https://www.asos.com/bershka/bershka-rustic-monochrome-floral-shirt-in-white/prd/204925734?clr=white&colourWayId=204925736&cid=3602
Bershka premium relaxed fit shirt in sand,https://www.asos.com/bershka/bershka-premium-relaxed-fit-shirt-in-sand/prd/204943432?clr=sand&colourWayId=204943435&cid=3602
ADPT oversized revere collar short sleeve shirt in cherry print in white,https://www.asos.com/adpt/adpt-oversized-revere-collar-short-sleeve-shirt-in-cherry-print-in-white/prd/204402832?clr=white&colourWayId=204402853&cid=3602
Pull&Bear striped short sleeve shirt in khaki,https://www.asos.com/pullbear/pullbear-striped-short-sleeve-shirt-in-khaki/prd/204885444?clr=black&colourWayId=204885446&cid=3602
ASOS DESIGN relaxed stripe shirt in green,https://www.asos.com/asos-design/asos-design-relaxed-stripe-shirt-in-green/prd/204328426?clr=green&colourWayId=204328447&cid=3602
ASOS DESIGN boxy oversized long shirt in vintage inspired abstract print,https://www.asos.com/asos-design/asos-design-boxy-oversized-long-shirt-in-vintage-inspired-abstract-print/prd/204059817?clr=multi&colourWayId=204059835&cid=3602
ASOS DESIGN stretch slim oxford stripe shirt in pink in cotton blend,https://www.asos.com/asos-design/asos-design-stretch-slim-oxford-stripe-shirt-in-pink-in-cotton-blend/prd/203648337?clr=pink&colourWayId=203648338&cid=3602
ASOS DESIGN revere shirt in black and white floral,https://www.asos.com/asos-design/asos-design-revere-shirt-in-black-and-white-floral/prd/204300916?clr=black&colourWayId=204300918&cid=3602
ASOS DESIGN regular linen revere shirt with roll sleeves in pink,https://www.asos.com/asos-design/asos-design-regular-linen-revere-shirt-with-roll-sleeves-in-pink/prd/204065468?clr=light-pink&colourWayId=204065474&cid=3602
ASOS DESIGN regular linen revere shirt with roll sleeves in dusty blue,https://www.asos.com/asos-design/asos-design-regular-linen-revere-shirt-with-roll-sleeves-in-dusty-blue/prd/204065530?clr=dusty-blue&colourWayId=204065540&cid=3602
Jack & Jones Originals floral revere collar short sleeve shirt in white,https://www.asos.com/jack-jones/jack-jones-originals-floral-revere-collar-short-sleeve-shirt-in-white/prd/203943830?clr=cloud-dancer&colourWayId=203943848&cid=3602
ASOS DESIGN stretch skinny shirt in black and blue floral print,https://www.asos.com/asos-design/asos-design-stretch-skinny-shirt-in-black-and-blue-floral-print/prd/203648311?clr=black&colourWayId=203648312&cid=3602
New Look long sleeve linen blend shirt in white,https://www.asos.com/new-look/new-look-long-sleeve-linen-blend-shirt-in-white/prd/204788463?clr=white&colourWayId=204788472&cid=3602
ASOS DESIGN stretch slim fit work shirt in blue,https://www.asos.com/asos-design/asos-design-stretch-slim-fit-work-shirt-in-blue/prd/203194358?clr=blue&colourWayId=203194364&cid=3602
ASOS DESIGN stretch skinny oxford stripe shirt in grey,https://www.asos.com/asos-design/asos-design-stretch-skinny-oxford-stripe-shirt-in-grey/prd/204059581?clr=grey&colourWayId=204059591&cid=3602
ASOS DESIGN relaxed fit linen shirt with revere collar in ecru,https://www.asos.com/asos-design/asos-design-relaxed-fit-linen-shirt-with-revere-collar-in-ecru/prd/203387040?clr=ecru&colourWayId=203387041&cid=3602
Jack & Jones Originals smart shirt in white,https://www.asos.com/jack-jones/jack-jones-originals-smart-shirt-in-white/prd/203573491?clr=white&colourWayId=203573492&cid=3602
ASOS DESIGN slim oxford shirt in duck egg blue,https://www.asos.com/asos-design/asos-design-slim-oxford-shirt-in-duck-egg-blue/prd/202737337?clr=duck-egg-blue&colourWayId=202737338&cid=3602
ASOS DESIGN 90s oversized linen shirt in white,https://www.asos.com/asos-design/asos-design-90s-oversized-linen-shirt-in-white/prd/201620233?clr=white&colourWayId=201620242&cid=3602
ASOS DESIGN 90s oversized cord shirt in pink,https://www.asos.com/asos-design/asos-design-90s-oversized-cord-shirt-in-pink/prd/202576167?clr=pink&colourWayId=202576188&cid=3602
ASOS DESIGN muscle fit jersey shirt in black,https://www.asos.com/asos-design/asos-design-muscle-fit-jersey-shirt-in-black/prd/203371021?clr=black&colourWayId=203371022&cid=3602
New Look short sleeve linen blend revere shirt in khaki,https://www.asos.com/new-look/new-look-short-sleeve-linen-blend-revere-shirt-in-khaki/prd/204732375?clr=dark-khaki&colourWayId=204732377&cid=3602
ASOS DESIGN stretch slim fit work shirt in navy,https://www.asos.com/asos-design/asos-design-stretch-slim-fit-work-shirt-in-navy/prd/201173205?clr=navy&colourWayId=201173206&cid=3602
ASOS DESIGN shirt in leaf scribble print,https://www.asos.com/asos-design/asos-design-shirt-in-leaf-scribble-print/prd/204328500?clr=white&colourWayId=204328512&cid=3602
ASOS DESIGN stretch slim shirt in black and grey floral print,https://www.asos.com/asos-design/asos-design-stretch-slim-shirt-in-black-and-grey-floral-print/prd/204059661?clr=black&colourWayId=204059664&cid=3602
ASOS DESIGN 90s oversized linen shirt in pink,https://www.asos.com/asos-design/asos-design-90s-oversized-linen-shirt-in-pink/prd/203677712?clr=pink&colourWayId=203677715&cid=3602
ASOS DESIGN boxy oversized textured check shirt in blue,https://www.asos.com/asos-design/asos-design-boxy-oversized-textured-check-shirt-in-blue/prd/204335504?clr=blue&colourWayId=204335505&cid=3602
ASOS DESIGN relaxed fit viscose shirt with low revere collar in black,https://www.asos.com/asos-design/asos-design-relaxed-fit-viscose-shirt-with-low-revere-collar-in-black/prd/203983953?clr=black&colourWayId=203983962&cid=3602
Topman smart shirt with stretch in black,https://www.asos.com/topman/topman-smart-shirt-with-stretch-in-black/prd/203057307?clr=black&colourWayId=203057308&cid=3602
ASOS DESIGN stretch slim fit work shirt in pink,https://www.asos.com/asos-design/asos-design-stretch-slim-fit-work-shirt-in-pink/prd/201551413?clr=pink&colourWayId=201551422&cid=3602
ASOS DESIGN shirt in sage green waffle stripe,https://www.asos.com/asos-design/asos-design-shirt-in-sage-green-waffle-stripe/prd/204328625?clr=sage&colourWayId=204328646&cid=3602
New Look long sleeve oxford shirt in white,https://www.asos.com/new-look/new-look-long-sleeve-oxford-shirt-in-white/prd/203325119?clr=white&colourWayId=203325121&cid=3602
ASOS DESIGN regular check shirt in black,https://www.asos.com/asos-design/asos-design-regular-check-shirt-in-black/prd/201445045?clr=black&colourWayId=201445054&cid=3602
ASOS DESIGN oversized 90s style cord shirt in sage green,https://www.asos.com/asos-design/asos-design-oversized-90s-style-cord-shirt-in-sage-green/prd/202576259?clr=sage-green&colourWayId=202576265&cid=3602
ASOS DESIGN regular linen mix shirt in ecru,https://www.asos.com/asos-design/asos-design-regular-linen-mix-shirt-in-ecru/prd/203828940?clr=ecru&colourWayId=203828942&cid=3602
ASOS DESIGN relaxed revere textured stripe shirt in blue,https://www.asos.com/asos-design/asos-design-relaxed-revere-textured-stripe-shirt-in-blue/prd/204328335?clr=blue&colourWayId=204328359&cid=3602
New Look waffle revere shirt co-ord in mid blue,https://www.asos.com/new-look/new-look-blue-waffle-co-ord/grp/204902898?clr=mid-blue&colourWayId=204738946&cid=3602#204738937
Reclaimed Vintage unisex knitted shirt in neutral with trim,https://www.asos.com/reclaimed-vintage/reclaimed-vintage-unisex-knitted-shirt-in-neutral-with-trim/prd/204035585?clr=stone&colourWayId=204035586&cid=3602
ASOS DESIGN relaxed revere shirt in white and black abstract dots,https://www.asos.com/asos-design/asos-design-relaxed-revere-shirt-in-white-and-black-abstract-dots/prd/204631549?clr=cream&colourWayId=204631565&cid=3602
ASOS DESIGN skinny fit western denim shirt in washed black,https://www.asos.com/asos-design/asos-design-skinny-fit-western-denim-shirt-in-washed-black/prd/201081725?clr=black&colourWayId=201081734&cid=3602
ASOS DESIGN brushed oxford shirt in off white,https://www.asos.com/asos-design/asos-design-brushed-oxford-shirt-in-off-white/prd/202576148?clr=off-white&colourWayId=202576149&cid=3602
ASOS DESIGN stretch slim fit work shirt in lilac,https://www.asos.com/asos-design/asos-design-stretch-slim-fit-work-shirt-in-lilac/prd/202637659?clr=soft-lilac&colourWayId=202637668&cid=3602
ASOS DESIGN skinny fit stripe shirt with grandad collar in grey,https://www.asos.com/asos-design/asos-design-skinny-fit-stripe-shirt-with-grandad-collar-in-grey/prd/202637678?clr=grey&colourWayId=202637679&cid=3602
ASOS DESIGN stretch slim fit work shirt in khaki,https://www.asos.com/asos-design/asos-design-stretch-slim-fit-work-shirt-in-khaki/prd/201173235?clr=khaki&colourWayId=201173236&cid=3602
ASOS DESIGN Premium slim fit sateen shirt in white,https://www.asos.com/asos-design/asos-design-premium-slim-fit-sateen-shirt-in-white/prd/203632500?clr=white&colourWayId=203632502&cid=3602
ASOS DESIGN 90s oversized shirt in black and white buffalo check,https://www.asos.com/asos-design/asos-design-90s-oversized-shirt-in-black-and-white-buffalo-check/prd/202667901?clr=white&colourWayId=202667942&cid=3602
ASOS DESIGN relaxed deep revere shirt in lightweight texture in stone,https://www.asos.com/asos-design/asos-design-relaxed-deep-revere-shirt-in-lightweight-texture-in-stone/prd/204366670?clr=stone&colourWayId=204366672&cid=3602
Bershka abstract tiger printed shirt in black,https://www.asos.com/bershka/bershka-abstract-tiger-printed-shirt-in-black/prd/204943461?clr=black&colourWayId=204943463&cid=3602
New Look retro print shirt in blue,https://www.asos.com/new-look/new-look-retro-print-shirt-in-blue/prd/204732302?clr=blue-pattern&colourWayId=204732305&cid=3602
New Look stripe shirt in bright pink,https://www.asos.com/new-look/new-look-stripe-shirt-in-bright-pink/prd/204765392?clr=bright-pink&colourWayId=204765393&cid=3602
ASOS DESIGN regular linen revere shirt with roll sleeves in white,https://www.asos.com/asos-design/asos-design-regular-linen-revere-shirt-with-roll-sleeves-in-white/prd/204065515?clr=white&colourWayId=204065517&cid=3602
ASOS DESIGN regular fit satin shirt in blue floral jacquard,https://www.asos.com/asos-design/asos-design-regular-fit-satin-shirt-in-blue-floral-jacquard/prd/202662077?clr=blue&colourWayId=202662078&cid=3602
ASOS DESIGN skinny fit shirt with grandad collar in blue,https://www.asos.com/asos-design/asos-design-skinny-fit-shirt-with-grandad-collar-in-blue/prd/202687037?clr=blue&colourWayId=202687060&cid=3602
ASOS DESIGN shirt in blue stripe,https://www.asos.com/asos-design/asos-design-shirt-in-blue-stripe/prd/204328106?clr=white&colourWayId=204328134&cid=3602
Only & Sons twill overshirt in brown,https://www.asos.com/only-sons/only-sons-twill-overshirt-in-brown/prd/203998364?clr=cub&colourWayId=203998415&cid=3602
ASOS DESIGN relaxed revere shirt in blue textured animal print,https://www.asos.com/asos-design/asos-design-relaxed-revere-shirt-in-blue-textured-animal-print/prd/204335480?clr=blue&colourWayId=204335481&cid=3602
ASOS DESIGN stretch slim fit work shirt in navy,https://www.asos.com/asos-design/asos-design-stretch-slim-fit-work-shirt-in-navy/prd/203194357?clr=navy&colourWayId=203194359&cid=3602
ASOS DESIGN skinny shirt with cutaway collar in white herringbone,https://www.asos.com/asos-design/asos-design-skinny-shirt-with-cutaway-collar-in-white-herringbone/prd/201614051?clr=white&colourWayId=201614052&cid=3602
New Look long sleeve grandad shirt in white,https://www.asos.com/new-look/new-look-long-sleeve-grandad-shirt-in-white/prd/203742790?clr=white&colourWayId=203742792&cid=3602
ASOS DESIGN relaxed shirt in aztec multi colour print,https://www.asos.com/asos-design/asos-design-relaxed-shirt-in-aztec-multi-colour-print/prd/201781916?clr=multi&colourWayId=201781957&cid=3602
ASOS DESIGN Premium easy iron slim sateen formal shirt with bib and wing collar in white,https://www.asos.com/asos-design/asos-design-premium-easy-iron-slim-sateen-formal-shirt-with-bib-and-wing-collar-in-white/prd/204367314?clr=white&colourWayId=204367323&cid=3602
ASOS DESIGN regular royal oxford shirt with double cuff in white,https://www.asos.com/asos-design/asos-design-regular-royal-oxford-shirt-with-double-cuff-in-white/prd/204322730?clr=white&colourWayId=204322740&cid=3602
New Look long sleeve linen blend shirt in dark pink,https://www.asos.com/new-look/new-look-long-sleeve-linen-blend-shirt-in-dark-pink/prd/204836544?clr=dark-pink&colourWayId=204836548&cid=3602
ASOS DESIGN stretch slim check shirt in grey,https://www.asos.com/asos-design/asos-design-stretch-slim-check-shirt-in-grey/prd/203648066?clr=grey&colourWayId=203648070&cid=3602
